,president,subgroup,date,approve,approve_hi,approve_lo,disapprove,disapprove_hi,disapprove_lo,timestamp,spread,datetime,date_display
7,Joe Biden,Adults,05-15-23,41.37,46.047873,36.683043,52.56,57.627184,47.49267,09:56:28 15 May 2023,-11.19,2023-05-15 09:56:28,May. 15
10,Joe Biden,Adults,05-12-23,41.37,46.047877,36.68304,52.56,57.627187,47.492667,09:23:14 12 May 2023,-11.19,2023-05-12 09:23:14,May. 12
13,Joe Biden,Adults,05-11-23,41.37,46.047871,36.683045,52.56,57.627185,47.492669,09:07:13 11 May 2023,-11.19,2023-05-11 09:07:13,May. 11
16,Joe Biden,Adults,05-10-23,41.31,46.145445,36.475196,52.72,57.921562,47.518919,20:40:13 10 May 2023,-11.41,2023-05-10 20:40:13,May. 10
19,Joe Biden,Adults,05-09-23,40.87,45.555582,36.175359,53.49,58.241046,48.737752,16:58:12  9 May 2023,-12.62,2023-05-09 16:58:12,May. 09
22,Joe Biden,Adults,05-08-23,40.87,45.555585,36.175357,53.49,58.241051,48.737747,11:37:12  8 May 2023,-12.62,2023-05-08 11:37:12,May. 08
28,Joe Biden,Adults,05-07-23,41.11,45.683848,36.536834,53.14,57.839044,48.444618,19:22:17  7 May 2023,-12.03,2023-05-07 19:22:17,May. 07
31,Joe Biden,Adults,05-05-23,41.11,45.683845,36.536837,53.14,57.839041,48.444621,09:25:11  5 May 2023,-12.03,2023-05-05 09:25:11,May. 05
34,Joe Biden,Adults,05-04-23,41.11,45.683842,36.53684,53.14,57.839041,48.444621,13:21:12  4 May 2023,-12.03,2023-05-04 13:21:12,May. 04
37,Joe Biden,Adults,05-03-23,41.08,45.817621,36.334491,53.15,57.986748,48.322248,10:00:14  3 May 2023,-12.08,2023-05-03 10:00:14,May. 03
40,Joe Biden,Adults,05-02-23,40.6,45.28879,35.908556,53.67,58.413039,48.936295,10:20:11  2 May 2023,-13.08,2023-05-02 10:20:11,May. 02
49,Joe Biden,Adults,05-01-23,41.3,45.417609,37.174844,53.51,58.285316,48.734154,09:07:21  1 May 2023,-12.21,2023-05-01 09:07:21,May. 01
52,Joe Biden,Adults,04-28-23,41.3,45.417609,37.174844,53.51,58.285316,48.734154,16:07:11 28 Apr 2023,-12.21,2023-04-28 16:07:11,Apr. 28
55,Joe Biden,Adults,04-27-23,41.3,45.417607,37.174847,53.51,58.285311,48.73416,15:28:11 27 Apr 2023,-12.21,2023-04-27 15:28:11,Apr. 27
58,Joe Biden,Adults,04-26-23,41.3,45.452108,37.138744,53.5,58.223744,48.775113,19:36:11 26 Apr 2023,-12.2,2023-04-26 19:36:11,Apr. 26
61,Joe Biden,Adults,04-25-23,40.36,44.059341,36.664834,54.22,58.925445,49.508343,15:27:11 25 Apr 2023,-13.85,2023-04-25 15:27:11,Apr. 25
64,Joe Biden,Adults,04-24-23,40.63,44.67346,36.592475,53.7,58.386765,49.019702,11:04:10 24 Apr 2023,-13.07,2023-04-24 11:04:10,Apr. 24
70,Joe Biden,Adults,04-23-23,40.57,44.712183,36.424994,53.73,58.530384,48.929745,16:22:10 23 Apr 2023,-13.16,2023-04-23 16:22:10,Apr. 23
73,Joe Biden,Adults,04-21-23,40.57,44.71218,36.424997,53.73,58.530381,48.929748,15:59:09 21 Apr 2023,-13.16,2023-04-21 15:59:09,Apr. 21
76,Joe Biden,Adults,04-20-23,40.66,44.958957,36.355943,53.49,58.255325,48.721751,09:36:10 20 Apr 2023,-12.83,2023-04-20 09:36:10,Apr. 20
79,Joe Biden,Adults,04-19-23,40.91,45.360803,36.467121,53.38,58.303959,48.449368,15:52:08 19 Apr 2023,-12.46,2023-04-19 15:52:08,Apr. 19
82,Joe Biden,Adults,04-18-23,41.81,46.259412,37.356889,53.13,58.547814,47.721823,17:58:07 18 Apr 2023,-11.33,2023-04-18 17:58:07,Apr. 18
85,Joe Biden,Adults,04-17-23,41.75,46.227863,37.275493,53.56,59.218108,47.903147,09:44:06 17 Apr 2023,-11.81,2023-04-17 09:44:06,Apr. 17
91,Joe Biden,Adults,04-16-23,41.71,46.290062,37.132666,52.43,57.929841,46.930108,10:24:13 16 Apr 2023,-10.72,2023-04-16 10:24:13,Apr. 16
94,Joe Biden,Adults,04-14-23,41.71,46.290063,37.132665,52.43,57.929843,46.930106,09:14:07 14 Apr 2023,-10.72,2023-04-14 09:14:07,Apr. 14
97,Joe Biden,Adults,04-13-23,41.71,46.290063,37.132665,52.43,57.92984,46.930109,09:17:08 13 Apr 2023,-10.72,2023-04-13 09:17:08,Apr. 13
100,Joe Biden,Adults,04-12-23,41.43,46.200485,36.655475,52.67,58.558107,46.782663,09:39:06 12 Apr 2023,-11.24,2023-04-12 09:39:06,Apr. 12
103,Joe Biden,Adults,04-11-23,40.9,45.326768,36.468224,53.25,58.893209,47.608194,09:11:08 11 Apr 2023,-12.35,2023-04-11 09:11:08,Apr. 11
112,Joe Biden,Adults,04-10-23,40.9,45.326764,36.468228,53.25,58.893206,47.608197,09:53:08 10 Apr 2023,-12.35,2023-04-10 09:53:08,Apr. 10
115,Joe Biden,Adults,04-07-23,40.9,45.326768,36.468224,53.25,58.893206,47.608196,15:13:06  7 Apr 2023,-12.35,2023-04-07 15:13:06,Apr. 07
118,Joe Biden,Adults,04-06-23,41.68,46.038497,37.329457,52.43,57.5896,47.273676,18:18:08  6 Apr 2023,-10.75,2023-04-06 18:18:08,Apr. 06
121,Joe Biden,Adults,04-05-23,41.83,46.316783,37.33925,52.39,57.848213,46.940213,10:48:05  5 Apr 2023,-10.57,2023-04-05 10:48:05,Apr. 05
124,Joe Biden,Adults,04-04-23,41.47,45.950259,36.985873,52.65,58.224178,47.076271,13:25:06  4 Apr 2023,-11.18,2023-04-04 13:25:06,Apr. 04
130,Joe Biden,Adults,04-03-23,41.01,45.267338,36.745954,53.57,58.612334,48.532135,09:38:08  3 Apr 2023,-12.57,2023-04-03 09:38:08,Apr. 03
133,Joe Biden,Adults,04-01-23,41.01,45.267337,36.745955,53.57,58.612334,48.532136,15:32:07  1 Apr 2023,-12.57,2023-04-01 15:32:07,Apr. 01
136,Joe Biden,Adults,03-31-23,40.98,45.254777,36.697208,53.59,58.676506,48.509803,09:17:07 31 Mar 2023,-12.62,2023-03-31 09:17:07,Mar. 31
139,Joe Biden,Adults,03-30-23,40.98,45.254776,36.697208,53.59,58.676506,48.509803,10:04:07 30 Mar 2023,-12.62,2023-03-30 10:04:07,Mar. 30
142,Joe Biden,Adults,03-29-23,41.19,45.529245,36.859615,53.29,58.158171,48.413172,19:19:06 29 Mar 2023,-12.09,2023-03-29 19:19:06,Mar. 29
145,Joe Biden,Adults,03-28-23,41.16,45.502282,36.827147,53.52,58.224102,48.818909,08:24:05 28 Mar 2023,-12.36,2023-03-28 08:24:05,Mar. 28
154,Joe Biden,Adults,03-27-23,41.19,45.58837,36.78876,53.49,58.206451,48.77483,09:50:10 27 Mar 2023,-12.3,2023-03-27 09:50:10,Mar. 27
157,Joe Biden,Adults,03-24-23,41.19,45.58837,36.78876,53.49,58.206452,48.774829,18:24:07 24 Mar 2023,-12.3,2023-03-24 18:24:07,Mar. 24
160,Joe Biden,Adults,03-23-23,41.19,45.588365,36.788765,53.49,58.206453,48.774828,09:37:06 23 Mar 2023,-12.3,2023-03-23 09:37:06,Mar. 23
163,Joe Biden,Adults,03-22-23,41.53,45.929726,37.134199,52.18,56.10103,48.255319,21:34:35 22 Mar 2023,-10.65,2023-03-22 21:34:35,Mar. 22
166,Joe Biden,Adults,03-21-23,41.66,46.069241,37.249083,52.12,56.331661,47.90526,14:58:06 21 Mar 2023,-10.46,2023-03-21 14:58:06,Mar. 21
175,Joe Biden,Adults,03-20-23,41.79,45.865527,37.712435,52.29,56.625529,47.96405,16:11:05 20 Mar 2023,-10.51,2023-03-20 16:11:05,Mar. 20
178,Joe Biden,Adults,03-17-23,41.79,45.865526,37.712436,52.29,56.625532,47.964046,10:03:07 17 Mar 2023,-10.51,2023-03-17 10:03:07,Mar. 17
181,Joe Biden,Adults,03-16-23,41.72,45.797057,37.636859,52.18,56.535907,47.830197,15:55:05 16 Mar 2023,-10.47,2023-03-16 15:55:05,Mar. 16
184,Joe Biden,Adults,03-15-23,42.05,46.351958,37.75434,52.01,56.565637,47.461138,14:26:03 15 Mar 2023,-9.96,2023-03-15 14:26:03,Mar. 15
187,Joe Biden,Adults,03-14-23,42.2,46.158408,38.25052,51.7,56.08767,47.307537,16:25:03 14 Mar 2023,-9.49,2023-03-14 16:25:03,Mar. 14
196,Joe Biden,Adults,03-13-23,42.19,46.159688,38.229972,51.71,56.113325,47.313727,12:05:57 13 Mar 2023,-9.52,2023-03-13 12:05:57,Mar. 13
199,Joe Biden,Adults,03-10-23,42.19,46.159688,38.229972,51.71,56.113331,47.313722,10:48:02 10 Mar 2023,-9.52,2023-03-10 10:48:02,Mar. 10
202,Joe Biden,Adults,03-09-23,42.34,46.205967,38.46451,51.51,56.017774,46.996864,12:05:02  9 Mar 2023,-9.17,2023-03-09 12:05:02,Mar. 09
205,Joe Biden,Adults,03-08-23,42.17,46.094645,38.238011,51.54,56.190869,46.891346,13:46:04  8 Mar 2023,-9.37,2023-03-08 13:46:04,Mar. 08
208,Joe Biden,Adults,03-07-23,42.78,46.549843,39.010611,51.26,56.265671,46.262144,15:06:03  7 Mar 2023,-8.48,2023-03-07 15:06:03,Mar. 07
217,Joe Biden,Adults,03-06-23,41.99,45.608847,38.373588,52.08,56.135756,48.02856,09:27:03  6 Mar 2023,-10.09,2023-03-06 09:27:03,Mar. 06
220,Joe Biden,Adults,03-03-23,41.99,45.61045,38.37486,52.08,56.13575,48.02856,12:05:25  3 Mar 2023,-10.09,2023-03-03 12:05:25,Mar. 03
223,Joe Biden,Adults,03-02-23,41.99,45.610451,38.374858,52.08,56.135756,48.028558,14:38:02  2 Mar 2023,-10.09,2023-03-02 14:38:02,Mar. 02
226,Joe Biden,Adults,03-01-23,42.14,45.870067,38.41699,51.92,56.102889,47.735949,14:02:01  1 Mar 2023,-9.78,2023-03-01 14:02:01,Mar. 01
229,Joe Biden,Adults,02-28-23,42.12,45.886259,38.354685,52.0,56.261154,47.745366,16:29:01 28 Feb 2023,-9.88,2023-02-28 16:29:01,Feb. 28
232,Joe Biden,Adults,02-27-23,42.39,46.164736,38.608887,51.63,55.975411,47.280755,10:52:04 27 Feb 2023,-9.24,2023-02-27 10:52:04,Feb. 27
238,Joe Biden,Adults,02-26-23,42.38,46.16313,38.602555,51.63,55.974499,47.276278,12:53:57 26 Feb 2023,-9.24,2023-02-26 12:53:57,Feb. 26
241,Joe Biden,Adults,02-24-23,42.38,46.16313,38.602555,51.63,55.974499,47.276278,17:14:01 24 Feb 2023,-9.24,2023-02-24 17:14:01,Feb. 24
244,Joe Biden,Adults,02-23-23,42.47,46.293608,38.653441,51.48,55.795701,47.162769,16:27:01 23 Feb 2023,-9.01,2023-02-23 16:27:01,Feb. 23
247,Joe Biden,Adults,02-22-23,43.1,47.115421,39.07659,50.89,55.498557,46.276702,15:14:00 22 Feb 2023,-7.79,2023-02-22 15:14:00,Feb. 22
250,Joe Biden,Adults,02-21-23,42.08,45.967151,38.196763,52.17,56.683534,47.659242,10:13:01 21 Feb 2023,-10.09,2023-02-21 10:13:01,Feb. 21
259,Joe Biden,Adults,02-20-23,41.76,45.4118,38.1101,52.29,56.989574,47.600181,12:49:48 20 Feb 2023,-10.53,2023-02-20 12:49:48,Feb. 20
262,Joe Biden,Adults,02-17-23,41.76,45.411801,38.110099,52.29,56.989584,47.600171,15:16:01 17 Feb 2023,-10.53,2023-02-17 15:16:01,Feb. 17
265,Joe Biden,Adults,02-16-23,42.07,45.751947,38.385719,52.27,57.097759,47.449309,11:17:00 16 Feb 2023,-10.2,2023-02-16 11:17:00,Feb. 16
268,Joe Biden,Adults,02-15-23,42.08,46.006478,38.160144,51.76,56.996825,46.530847,11:46:01 15 Feb 2023,-9.68,2023-02-15 11:46:01,Feb. 15
271,Joe Biden,Adults,02-14-23,41.94,45.881233,37.991643,51.96,57.190571,46.731991,09:24:59 14 Feb 2023,-10.02,2023-02-14 09:24:59,Feb. 14
277,Joe Biden,Adults,02-13-23,41.94,45.881227,37.991649,51.96,57.190566,46.731996,09:06:56 13 Feb 2023,-10.02,2023-02-13 09:06:56,Feb. 13
280,Joe Biden,Adults,02-11-23,41.94,45.881227,37.991649,51.96,57.190564,46.731998,19:57:00 11 Feb 2023,-10.02,2023-02-11 19:57:00,Feb. 11
283,Joe Biden,Adults,02-10-23,42.02,46.003355,38.045919,51.94,57.222332,46.662439,16:24:00 10 Feb 2023,-9.92,2023-02-10 16:24:00,Feb. 10
286,Joe Biden,Adults,02-09-23,42.12,46.164747,38.073575,51.75,57.064949,46.437316,09:31:00  9 Feb 2023,-9.63,2023-02-09 09:31:00,Feb. 09
289,Joe Biden,Adults,02-08-23,42.48,46.56527,38.397153,51.54,56.991357,46.09533,14:11:00  8 Feb 2023,-9.06,2023-02-08 14:11:00,Feb. 08
292,Joe Biden,Adults,02-07-23,43.24,47.393658,39.091999,51.83,57.553788,46.097505,09:16:59  7 Feb 2023,-8.58,2023-02-07 09:16:59,Feb. 07
295,Joe Biden,Adults,02-06-23,43.24,47.393656,39.092001,51.83,57.553788,46.097505,11:57:59  6 Feb 2023,-8.58,2023-02-06 11:57:59,Feb. 06
301,Joe Biden,Adults,02-05-23,41.19,45.174202,37.214255,52.68,57.793172,47.567412,14:15:52  5 Feb 2023,-11.49,2023-02-05 14:15:52,Feb. 05
304,Joe Biden,Adults,02-03-23,41.19,45.174202,37.214255,52.68,57.793177,47.567406,13:31:59  3 Feb 2023,-11.49,2023-02-03 13:31:59,Feb. 03
307,Joe Biden,Adults,02-02-23,41.19,45.174205,37.214252,52.68,57.793177,47.567406,09:13:58  2 Feb 2023,-11.49,2023-02-02 09:13:58,Feb. 02
310,Joe Biden,Adults,02-01-23,41.79,45.938996,37.637915,52.02,57.137244,46.900123,19:09:57  1 Feb 2023,-10.23,2023-02-01 19:09:57,Feb. 01
313,Joe Biden,Adults,01-31-23,41.61,45.888703,37.340195,52.82,57.912159,47.72717,14:14:58 31 Jan 2023,-11.21,2023-01-31 14:14:58,Jan. 31
316,Joe Biden,Adults,01-30-23,42.05,46.266915,37.832181,52.04,56.455777,47.616396,17:41:58 30 Jan 2023,-9.99,2023-01-30 17:41:58,Jan. 30
322,Joe Biden,Adults,01-29-23,40.41,44.673776,36.143165,52.82,56.971886,48.664731,13:35:53 29 Jan 2023,-12.41,2023-01-29 13:35:53,Jan. 29
325,Joe Biden,Adults,01-27-23,40.41,44.673769,36.143171,52.82,56.971886,48.664731,10:07:57 27 Jan 2023,-12.41,2023-01-27 10:07:57,Jan. 27
328,Joe Biden,Adults,01-26-23,40.39,44.733184,36.049937,52.69,56.840325,48.537248,14:54:57 26 Jan 2023,-12.3,2023-01-26 14:54:57,Jan. 26
331,Joe Biden,Adults,01-25-23,40.55,45.14202,35.964036,52.28,56.450347,48.114058,17:57:57 25 Jan 2023,-11.73,2023-01-25 17:57:57,Jan. 25
334,Joe Biden,Adults,01-24-23,40.68,45.120455,36.241167,52.18,56.53512,47.832452,10:31:58 24 Jan 2023,-11.5,2023-01-24 10:31:58,Jan. 24
343,Joe Biden,Adults,01-23-23,40.79,45.390785,36.189993,51.84,56.21754,47.468706,09:13:38 23 Jan 2023,-11.05,2023-01-23 09:13:38,Jan. 23
346,Joe Biden,Adults,01-20-23,40.79,45.390782,36.189997,51.84,56.217532,47.468714,18:06:57 20 Jan 2023,-11.05,2023-01-20 18:06:57,Jan. 20
349,Joe Biden,Adults,01-19-23,41.77,46.496364,37.049781,51.45,55.999885,46.904558,09:18:57 19 Jan 2023,-9.68,2023-01-19 09:18:57,Jan. 19
352,Joe Biden,Adults,01-18-23,42.14,47.082614,37.192125,51.17,55.874366,46.460703,19:29:56 18 Jan 2023,-9.03,2023-01-18 19:29:56,Jan. 18
364,Joe Biden,Adults,01-17-23,42.68,46.931097,38.422926,51.23,56.327572,46.137905,09:53:29 17 Jan 2023,-8.56,2023-01-17 09:53:29,Jan. 17
367,Joe Biden,Adults,01-13-23,42.68,46.931523,38.423321,51.24,56.330994,46.141717,09:09:55 13 Jan 2023,-8.56,2023-01-13 09:09:55,Jan. 13
370,Joe Biden,Adults,01-12-23,42.68,46.931523,38.423321,51.24,56.330988,46.141723,16:40:57 12 Jan 2023,-8.56,2023-01-12 16:40:57,Jan. 12
373,Joe Biden,Adults,01-11-23,43.0,46.823317,39.169316,51.21,56.685615,45.734813,17:04:56 11 Jan 2023,-8.21,2023-01-11 17:04:56,Jan. 11
376,Joe Biden,Adults,01-10-23,42.45,45.818035,39.091203,52.01,57.26055,46.767482,15:13:56 10 Jan 2023,-9.56,2023-01-10 15:13:56,Jan. 10
385,Joe Biden,Adults,01-09-23,41.76,45.46069,38.063743,51.13,55.810089,46.441332,09:24:34  9 Jan 2023,-9.36,2023-01-09 09:24:34,Jan. 09
388,Joe Biden,Adults,01-06-23,41.76,45.460687,38.063746,51.13,55.810089,46.441332,10:55:56  6 Jan 2023,-9.36,2023-01-06 10:55:56,Jan. 06
391,Joe Biden,Adults,01-05-23,41.76,45.460687,38.063746,51.13,55.810091,46.44133,09:11:55  5 Jan 2023,-9.36,2023-01-05 09:11:55,Jan. 05
394,Joe Biden,Adults,01-04-23,42.02,45.817228,38.219986,50.75,55.543116,45.957224,11:51:56  4 Jan 2023,-8.73,2023-01-04 11:51:56,Jan. 04
406,Joe Biden,Adults,01-03-23,41.5,45.045024,37.96194,51.69,55.684265,47.697735,09:16:21  3 Jan 2023,-10.19,2023-01-03 09:16:21,Jan. 03
409,Joe Biden,Adults,12-30-22,41.5,45.04502,37.961944,51.69,55.684261,47.697739,09:41:54 30 Dec 2022,-10.19,2022-12-30 09:41:54,Dec. 30
412,Joe Biden,Adults,12-29-22,41.5,45.045021,37.961943,51.69,55.684258,47.697742,09:22:55 29 Dec 2022,-10.19,2022-12-29 09:22:55,Dec. 29
415,Joe Biden,Adults,12-28-22,41.65,45.200234,38.092628,51.48,55.558398,47.391655,09:40:56 28 Dec 2022,-9.83,2022-12-28 09:40:56,Dec. 28
424,Joe Biden,Adults,12-27-22,41.65,45.200234,38.092628,51.48,55.558394,47.391659,09:15:32 27 Dec 2022,-9.83,2022-12-27 09:15:32,Dec. 27
430,Joe Biden,Adults,12-24-22,41.65,45.200233,38.092629,51.48,55.558391,47.391663,10:38:43 24 Dec 2022,-9.83,2022-12-24 10:38:43,Dec. 24
433,Joe Biden,Adults,12-22-22,41.65,45.200237,38.092625,51.48,55.558398,47.391656,09:28:55 22 Dec 2022,-9.83,2022-12-22 09:28:55,Dec. 22
436,Joe Biden,Adults,12-21-22,41.74,45.384833,38.097988,51.14,55.327339,46.959752,13:06:54 21 Dec 2022,-9.4,2022-12-21 13:06:54,Dec. 21
439,Joe Biden,Adults,12-20-22,41.3,44.734582,37.860151,50.97,55.195907,46.741403,09:30:56 20 Dec 2022,-9.67,2022-12-20 09:30:56,Dec. 20
448,Joe Biden,Adults,12-19-22,41.3,44.734575,37.860158,50.97,55.195908,46.741402,08:38:29 19 Dec 2022,-9.67,2022-12-19 08:38:29,Dec. 19
451,Joe Biden,Adults,12-16-22,41.3,44.734582,37.86015,50.97,55.195906,46.741403,21:10:54 16 Dec 2022,-9.67,2022-12-16 21:10:54,Dec. 16
454,Joe Biden,Adults,12-15-22,41.3,44.734578,37.860154,50.97,55.195902,46.741407,15:43:54 15 Dec 2022,-9.67,2022-12-15 15:43:54,Dec. 15
457,Joe Biden,Adults,12-14-22,41.19,44.720418,37.651954,51.39,55.67212,47.117339,18:43:52 14 Dec 2022,-10.21,2022-12-14 18:43:52,Dec. 14
460,Joe Biden,Adults,12-13-22,40.53,44.475874,36.584065,53.15,57.494366,48.81563,16:34:08 13 Dec 2022,-12.63,2022-12-13 16:34:08,Dec. 13
469,Joe Biden,Adults,12-12-22,40.97,44.982371,36.961043,52.92,56.756031,49.085501,08:47:38 12 Dec 2022,-11.95,2022-12-12 08:47:38,Dec. 12
472,Joe Biden,Adults,12-09-22,40.97,44.982371,36.961043,52.92,56.756031,49.085501,14:17:53  9 Dec 2022,-11.95,2022-12-09 14:17:53,Dec. 09
475,Joe Biden,Adults,12-08-22,40.48,44.352093,36.606326,52.99,56.963794,49.024876,09:46:52  8 Dec 2022,-12.52,2022-12-08 09:46:52,Dec. 08
478,Joe Biden,Adults,12-07-22,40.46,44.599671,36.322074,52.87,57.079265,48.658088,15:38:51  7 Dec 2022,-12.41,2022-12-07 15:38:51,Dec. 07
481,Joe Biden,Adults,12-06-22,40.38,44.409021,36.349848,52.82,57.028215,48.608624,17:17:52  6 Dec 2022,-12.44,2022-12-06 17:17:52,Dec. 06
490,Joe Biden,Adults,12-05-22,40.28,44.433516,36.12543,52.97,57.262427,48.667717,08:31:26  5 Dec 2022,-12.69,2022-12-05 08:31:26,Dec. 05
493,Joe Biden,Adults,12-02-22,40.28,44.433512,36.125433,52.97,57.262422,48.667723,16:51:51  2 Dec 2022,-12.69,2022-12-02 16:51:51,Dec. 02
496,Joe Biden,Adults,12-01-22,40.28,44.433516,36.12543,52.97,57.262419,48.667725,09:52:51  1 Dec 2022,-12.69,2022-12-01 09:52:51,Dec. 01
499,Joe Biden,Adults,11-30-22,40.09,44.226145,35.961762,52.96,57.433488,48.492082,13:48:50 30 Nov 2022,-12.87,2022-11-30 13:48:50,Nov. 30
502,Joe Biden,Adults,11-29-22,40.32,44.63994,36.001253,53.28,57.882108,48.667926,17:44:51 29 Nov 2022,-12.95,2022-11-29 17:44:51,Nov. 29
505,Joe Biden,Adults,11-28-22,40.38,44.613108,36.151723,53.07,57.479594,48.662948,13:33:08 28 Nov 2022,-12.69,2022-11-28 13:33:08,Nov. 28
517,Joe Biden,Adults,11-27-22,40.99,45.273898,36.713303,52.56,56.952545,48.163386,12:27:10 27 Nov 2022,-11.56,2022-11-27 12:27:10,Nov. 27
520,Joe Biden,Adults,11-23-22,40.99,45.273898,36.713303,52.56,56.952542,48.163388,10:28:50 23 Nov 2022,-11.56,2022-11-23 10:28:50,Nov. 23
523,Joe Biden,Adults,11-22-22,40.58,44.870289,36.28827,53.49,57.373762,49.598341,18:03:50 22 Nov 2022,-12.91,2022-11-22 18:03:50,Nov. 22
532,Joe Biden,Adults,11-21-22,40.62,44.476431,36.763808,53.34,57.484819,49.204708,11:34:49 21 Nov 2022,-12.72,2022-11-21 11:34:49,Nov. 21
535,Joe Biden,Adults,11-18-22,40.62,44.476424,36.763815,53.34,57.484811,49.204715,16:19:51 18 Nov 2022,-12.72,2022-11-18 16:19:51,Nov. 18
538,Joe Biden,Adults,11-17-22,40.16,44.159322,36.167392,53.27,57.564469,48.971038,14:44:51 17 Nov 2022,-13.1,2022-11-17 14:44:51,Nov. 17
541,Joe Biden,Adults,11-16-22,40.2,44.33343,36.062129,53.28,57.667989,48.882328,14:43:49 16 Nov 2022,-13.08,2022-11-16 14:43:49,Nov. 16
544,Joe Biden,Adults,11-15-22,40.23,44.232206,36.228585,53.3,57.452575,49.143204,09:47:50 15 Nov 2022,-13.07,2022-11-15 09:47:50,Nov. 15
553,Joe Biden,Adults,11-14-22,40.06,44.017288,36.109287,53.25,57.366298,49.132353,09:40:19 14 Nov 2022,-13.19,2022-11-14 09:40:19,Nov. 14
556,Joe Biden,Adults,11-11-22,40.06,44.017291,36.109284,53.25,57.366292,49.13236,09:47:49 11 Nov 2022,-13.19,2022-11-11 09:47:49,Nov. 11
559,Joe Biden,Adults,11-10-22,39.86,43.762075,35.960264,53.28,57.407513,49.156111,09:35:50 10 Nov 2022,-13.42,2022-11-10 09:35:50,Nov. 10
562,Joe Biden,Adults,11-09-22,39.86,43.806286,35.91021,53.23,57.41632,49.03879,16:57:49  9 Nov 2022,-13.37,2022-11-09 16:57:49,Nov. 09
565,Joe Biden,Adults,11-08-22,40.06,43.876283,36.234723,53.02,57.128906,48.902938,13:47:49  8 Nov 2022,-12.96,2022-11-08 13:47:49,Nov. 08
568,Joe Biden,Adults,11-07-22,40.04,43.855597,36.230431,53.0,57.121983,48.882361,22:34:14  7 Nov 2022,-12.96,2022-11-07 22:34:14,Nov. 07
574,Joe Biden,Adults,11-06-22,40.74,44.555809,36.921872,52.59,56.814338,48.35652,11:01:00  6 Nov 2022,-11.85,2022-11-06 11:01:00,Nov. 06
577,Joe Biden,Adults,11-04-22,40.74,44.555809,36.921872,52.59,56.814333,48.356525,13:07:49  4 Nov 2022,-11.85,2022-11-04 13:07:49,Nov. 04
580,Joe Biden,Adults,11-03-22,40.68,44.415846,36.953019,52.57,56.883828,48.253168,19:53:48  3 Nov 2022,-11.88,2022-11-03 19:53:48,Nov. 03
583,Joe Biden,Adults,11-02-22,40.54,44.345677,36.743265,52.55,56.944313,48.164405,19:11:48  2 Nov 2022,-12.01,2022-11-02 19:11:48,Nov. 02
586,Joe Biden,Adults,11-01-22,39.95,43.401469,36.496786,53.75,58.149209,49.348249,18:55:48  1 Nov 2022,-13.8,2022-11-01 18:55:48,Nov. 01
589,Joe Biden,Adults,10-31-22,40.04,43.415482,36.670028,53.62,57.953722,49.278545,15:25:49 31 Oct 2022,-13.57,2022-10-31 15:25:49,Oct. 31
595,Joe Biden,Adults,10-30-22,40.03,43.399873,36.669446,53.62,57.955698,49.2797,13:35:50 30 Oct 2022,-13.58,2022-10-30 13:35:50,Oct. 30
598,Joe Biden,Adults,10-28-22,40.03,43.399873,36.669446,53.62,57.9557,49.279698,18:17:48 28 Oct 2022,-13.58,2022-10-28 18:17:48,Oct. 28
601,Joe Biden,Adults,10-27-22,40.03,43.399873,36.669446,53.62,57.9557,49.279697,13:57:47 27 Oct 2022,-13.58,2022-10-27 13:57:47,Oct. 27
604,Joe Biden,Adults,10-26-22,40.01,43.484535,36.535506,53.72,58.195992,49.251315,13:18:47 26 Oct 2022,-13.71,2022-10-26 13:18:47,Oct. 26
607,Joe Biden,Adults,10-25-22,39.75,43.35805,36.150763,54.08,58.737092,49.42725,19:13:47 25 Oct 2022,-14.33,2022-10-25 19:13:47,Oct. 25
610,Joe Biden,Adults,10-24-22,39.75,43.372397,36.134003,54.05,58.74357,49.357068,14:42:47 24 Oct 2022,-14.3,2022-10-24 14:42:47,Oct. 24
616,Joe Biden,Adults,10-23-22,39.77,43.443756,36.096871,54.11,58.8647,49.361359,11:09:44 23 Oct 2022,-14.34,2022-10-23 11:09:44,Oct. 23
619,Joe Biden,Adults,10-21-22,39.77,43.443756,36.096871,54.11,58.864698,49.361361,10:56:46 21 Oct 2022,-14.34,2022-10-21 10:56:46,Oct. 21
622,Joe Biden,Adults,10-20-22,40.13,43.838311,36.416002,53.86,58.707759,49.013977,15:11:02 20 Oct 2022,-13.73,2022-10-20 15:11:02,Oct. 20
625,Joe Biden,Adults,10-19-22,40.88,44.683712,37.080864,52.9,57.413977,48.378707,15:40:46 19 Oct 2022,-12.01,2022-10-19 15:40:46,Oct. 19
628,Joe Biden,Adults,10-18-22,41.2,44.954935,37.45393,52.59,57.219533,47.968869,16:16:46 18 Oct 2022,-11.39,2022-10-18 16:16:46,Oct. 18
631,Joe Biden,Adults,10-17-22,41.29,45.010509,37.569495,52.44,57.089524,47.780802,09:39:45 17 Oct 2022,-11.15,2022-10-17 09:39:45,Oct. 17
634,Joe Biden,Adults,10-16-22,41.29,45.010514,37.569501,52.44,57.089693,47.780941,12:56:50 16 Oct 2022,-11.15,2022-10-16 12:56:50,Oct. 16
637,Joe Biden,Adults,10-15-22,41.29,45.010514,37.569501,52.44,57.08969,47.780944,12:39:46 15 Oct 2022,-11.15,2022-10-15 12:39:46,Oct. 15
640,Joe Biden,Adults,10-14-22,41.29,45.010514,37.569501,52.44,57.089702,47.780932,17:15:46 14 Oct 2022,-11.15,2022-10-14 17:15:46,Oct. 14
643,Joe Biden,Adults,10-13-22,41.29,45.010508,37.569507,52.44,57.089693,47.780941,14:52:58 13 Oct 2022,-11.15,2022-10-13 14:52:58,Oct. 13
646,Joe Biden,Adults,10-12-22,41.39,45.224228,37.560858,52.11,56.922588,47.302953,13:33:44 12 Oct 2022,-10.72,2022-10-12 13:33:44,Oct. 12
649,Joe Biden,Adults,10-11-22,40.93,44.622678,37.228958,52.5,56.78883,48.204225,17:29:45 11 Oct 2022,-11.57,2022-10-11 17:29:45,Oct. 11
655,Joe Biden,Adults,10-10-22,41.16,45.075401,37.243257,52.06,56.203784,47.909825,09:33:23 10 Oct 2022,-10.9,2022-10-10 09:33:23,Oct. 10
658,Joe Biden,Adults,10-08-22,41.16,45.075403,37.243255,52.06,56.203786,47.909823,10:42:45  8 Oct 2022,-10.9,2022-10-08 10:42:45,Oct. 08
661,Joe Biden,Adults,10-07-22,41.17,45.149258,37.188454,51.61,55.76826,47.44686,19:31:45  7 Oct 2022,-10.44,2022-10-07 19:31:45,Oct. 07
664,Joe Biden,Adults,10-06-22,41.2,45.258675,37.142887,51.3,55.200516,47.397636,09:43:44  6 Oct 2022,-10.1,2022-10-06 09:43:44,Oct. 06
667,Joe Biden,Adults,10-05-22,40.22,44.314414,36.121569,52.18,56.130701,48.239222,18:21:44  5 Oct 2022,-11.97,2022-10-05 18:21:44,Oct. 05
670,Joe Biden,Adults,10-04-22,39.97,44.079843,35.853872,52.54,56.202407,48.87048,11:44:44  4 Oct 2022,-12.57,2022-10-04 11:44:44,Oct. 04
679,Joe Biden,Adults,10-03-22,40.24,44.375067,36.109499,52.53,56.214548,48.852727,10:10:00  3 Oct 2022,-12.29,2022-10-03 10:10:00,Oct. 03
682,Joe Biden,Adults,09-30-22,40.24,44.375064,36.109502,52.53,56.214553,48.852721,09:53:44 30 Sep 2022,-12.29,2022-09-30 09:53:44,Sep. 30
685,Joe Biden,Adults,09-29-22,40.24,44.375068,36.109498,52.53,56.214555,48.85272,13:42:43 29 Sep 2022,-12.29,2022-09-29 13:42:43,Sep. 29
688,Joe Biden,Adults,09-28-22,40.31,44.534626,36.082473,52.32,56.134196,48.504864,18:35:43 28 Sep 2022,-12.01,2022-09-28 18:35:43,Sep. 28
691,Joe Biden,Adults,09-27-22,40.82,44.748272,36.885732,52.98,56.903925,49.050923,18:32:42 27 Sep 2022,-12.16,2022-09-27 18:32:42,Sep. 27
694,Joe Biden,Adults,09-26-22,40.81,44.707638,36.909262,53.04,56.989625,49.099566,13:18:43 26 Sep 2022,-12.24,2022-09-26 13:18:43,Sep. 26
697,Joe Biden,Adults,09-25-22,40.88,44.839257,36.926787,52.99,56.952644,49.035698,12:16:57 25 Sep 2022,-12.11,2022-09-25 12:16:57,Sep. 25
700,Joe Biden,Adults,09-24-22,41.32,45.274892,37.368031,53.17,57.301552,49.042474,12:29:42 24 Sep 2022,-11.85,2022-09-24 12:29:42,Sep. 24
703,Joe Biden,Adults,09-23-22,41.3,45.267073,37.331442,53.14,57.260541,49.020538,17:28:55 23 Sep 2022,-11.84,2022-09-23 17:28:55,Sep. 23
706,Joe Biden,Adults,09-22-22,41.46,45.462826,37.461393,53.07,57.257355,48.878294,10:26:41 22 Sep 2022,-11.61,2022-09-22 10:26:41,Sep. 22
709,Joe Biden,Adults,09-21-22,41.07,45.15005,36.992758,53.26,57.568999,48.958689,20:14:42 21 Sep 2022,-12.19,2022-09-21 20:14:42,Sep. 21
712,Joe Biden,Adults,09-20-22,41.2,45.651115,36.754284,53.58,58.180169,48.975858,17:52:41 20 Sep 2022,-12.38,2022-09-20 17:52:41,Sep. 20
715,Joe Biden,Adults,09-19-22,41.45,45.75571,37.136962,53.04,57.238789,48.843311,09:58:40 19 Sep 2022,-11.59,2022-09-19 09:58:40,Sep. 19
721,Joe Biden,Adults,09-18-22,41.44,45.750147,37.132628,53.04,57.238628,48.839637,14:52:24 18 Sep 2022,-11.6,2022-09-18 14:52:24,Sep. 18
724,Joe Biden,Adults,09-16-22,41.44,45.75014,37.132635,53.04,57.238632,48.839632,15:38:40 16 Sep 2022,-11.6,2022-09-16 15:38:40,Sep. 16
727,Joe Biden,Adults,09-15-22,41.43,45.729107,37.125777,53.04,57.241218,48.841326,09:45:41 15 Sep 2022,-11.61,2022-09-15 09:45:41,Sep. 15
730,Joe Biden,Adults,09-14-22,41.17,45.517012,36.822923,53.36,57.772233,48.956049,20:44:40 14 Sep 2022,-12.19,2022-09-14 20:44:40,Sep. 14
733,Joe Biden,Adults,09-13-22,41.55,45.802619,37.304055,53.41,58.061011,48.758369,16:50:53 13 Sep 2022,-11.86,2022-09-13 16:50:53,Sep. 13
742,Joe Biden,Adults,09-12-22,40.82,44.150881,37.482033,53.46,57.804313,49.119548,09:30:50 12 Sep 2022,-12.65,2022-09-12 09:30:50,Sep. 12
745,Joe Biden,Adults,09-09-22,40.82,44.150891,37.482022,53.46,57.804319,49.119542,09:48:40  9 Sep 2022,-12.65,2022-09-09 09:48:40,Sep. 09
748,Joe Biden,Adults,09-08-22,40.82,44.150881,37.482033,53.46,57.804313,49.119548,10:20:45  8 Sep 2022,-12.65,2022-09-08 10:20:45,Sep. 08
751,Joe Biden,Adults,09-07-22,40.87,44.385827,37.358584,53.3,57.920955,48.684783,19:23:40  7 Sep 2022,-12.43,2022-09-07 19:23:40,Sep. 07
754,Joe Biden,Adults,09-06-22,41.06,44.842142,37.274789,52.97,57.497831,48.448526,19:14:39  6 Sep 2022,-11.91,2022-09-06 19:14:39,Sep. 06
763,Joe Biden,Adults,09-05-22,41.06,44.842146,37.274785,52.97,57.497831,48.448526,18:59:46  5 Sep 2022,-11.91,2022-09-05 18:59:46,Sep. 05
766,Joe Biden,Adults,09-02-22,41.06,44.842144,37.274786,52.97,57.497841,48.448516,12:15:39  2 Sep 2022,-11.91,2022-09-02 12:15:39,Sep. 02
769,Joe Biden,Adults,09-01-22,41.06,44.842148,37.274783,52.97,57.497838,48.448519,09:45:49  1 Sep 2022,-11.91,2022-09-01 09:45:49,Sep. 01
772,Joe Biden,Adults,08-31-22,40.77,44.529229,37.007925,53.12,57.757372,48.485588,14:17:38 31 Aug 2022,-12.35,2022-08-31 14:17:38,Aug. 31
775,Joe Biden,Adults,08-30-22,39.79,43.952822,35.622994,54.33,59.245242,49.418638,18:51:38 30 Aug 2022,-14.54,2022-08-30 18:51:38,Aug. 30
778,Joe Biden,Adults,08-29-22,40.29,44.287553,36.286294,53.78,58.407963,49.146112,09:46:38 29 Aug 2022,-13.49,2022-08-29 09:46:38,Aug. 29
784,Joe Biden,Adults,08-28-22,40.29,44.287562,36.286285,53.78,58.407966,49.146108,11:44:15 28 Aug 2022,-13.49,2022-08-28 11:44:15,Aug. 28
787,Joe Biden,Adults,08-26-22,40.29,44.287556,36.286291,53.78,58.40796,49.146114,21:01:38 26 Aug 2022,-13.49,2022-08-26 21:01:38,Aug. 26
790,Joe Biden,Adults,08-25-22,39.64,43.345268,35.93586,54.31,58.675176,49.948402,14:50:38 25 Aug 2022,-14.67,2022-08-25 14:50:38,Aug. 25
793,Joe Biden,Adults,08-24-22,39.21,42.789093,35.624097,54.71,59.192468,50.221823,20:26:37 24 Aug 2022,-15.5,2022-08-24 20:26:37,Aug. 24
796,Joe Biden,Adults,08-23-22,38.45,42.175589,34.723845,55.55,60.219996,50.88092,14:38:37 23 Aug 2022,-17.1,2022-08-23 14:38:37,Aug. 23
799,Joe Biden,Adults,08-22-22,38.85,42.579597,35.112101,55.14,59.396456,50.879134,15:45:38 22 Aug 2022,-16.29,2022-08-22 15:45:38,Aug. 22
805,Joe Biden,Adults,08-21-22,39.34,42.9109,35.765976,54.78,58.830408,50.724647,15:01:11 21 Aug 2022,-15.44,2022-08-21 15:01:11,Aug. 21
808,Joe Biden,Adults,08-19-22,39.34,42.910902,35.765974,54.78,58.830399,50.724656,12:25:38 19 Aug 2022,-15.44,2022-08-19 12:25:38,Aug. 19
811,Joe Biden,Adults,08-18-22,39.33,42.904299,35.765293,54.77,58.82774,50.72071,10:19:37 18 Aug 2022,-15.44,2022-08-18 10:19:37,Aug. 18
814,Joe Biden,Adults,08-17-22,39.16,42.793505,35.532955,54.99,59.135416,50.84825,18:28:37 17 Aug 2022,-15.83,2022-08-17 18:28:37,Aug. 17
817,Joe Biden,Adults,08-16-22,38.72,42.27146,35.161308,55.51,59.191023,51.829329,09:36:36 16 Aug 2022,-16.79,2022-08-16 09:36:36,Aug. 16
826,Joe Biden,Adults,08-15-22,38.74,42.370091,35.113338,55.78,59.411886,52.147475,09:14:40 15 Aug 2022,-17.04,2022-08-15 09:14:40,Aug. 15
829,Joe Biden,Adults,08-12-22,38.74,42.370096,35.113333,55.78,59.411886,52.147475,09:54:37 12 Aug 2022,-17.04,2022-08-12 09:54:37,Aug. 12
832,Joe Biden,Adults,08-11-22,38.56,42.188494,34.934595,55.79,59.418874,52.168442,20:52:36 11 Aug 2022,-17.23,2022-08-11 20:52:36,Aug. 11
835,Joe Biden,Adults,08-10-22,38.39,42.09608,34.676034,55.9,59.561378,52.239655,13:52:36 10 Aug 2022,-17.51,2022-08-10 13:52:36,Aug. 10
838,Joe Biden,Adults,08-09-22,38.31,42.164664,34.463155,55.99,59.784188,52.198741,20:22:36  9 Aug 2022,-17.68,2022-08-09 20:22:36,Aug. 09
847,Joe Biden,Adults,08-08-22,37.53,41.192198,33.864426,56.17,60.259578,52.089444,09:40:39  8 Aug 2022,-18.65,2022-08-08 09:40:39,Aug. 08
850,Joe Biden,Adults,08-05-22,37.53,41.192198,33.864426,56.17,60.25958,52.089442,18:53:41  5 Aug 2022,-18.65,2022-08-05 18:53:41,Aug. 05
853,Joe Biden,Adults,08-04-22,37.53,41.192198,33.864426,56.17,60.259581,52.089441,09:56:36  4 Aug 2022,-18.65,2022-08-04 09:56:36,Aug. 04
856,Joe Biden,Adults,08-03-22,37.51,41.290215,33.737747,56.24,60.407473,52.073122,13:12:36  3 Aug 2022,-18.73,2022-08-03 13:12:36,Aug. 03
859,Joe Biden,Adults,08-02-22,36.98,41.021327,32.944476,56.69,61.135388,52.236157,16:39:35  2 Aug 2022,-19.7,2022-08-02 16:39:35,Aug. 02
862,Joe Biden,Adults,08-01-22,37.3,41.253384,33.340406,56.74,61.370121,52.105952,10:03:36  1 Aug 2022,-19.44,2022-08-01 10:03:36,Aug. 01
868,Joe Biden,Adults,07-31-22,36.95,40.921228,32.981161,56.9,61.637068,52.155888,13:00:11 31 Jul 2022,-19.95,2022-07-31 13:00:11,Jul. 31
871,Joe Biden,Adults,07-29-22,36.95,40.921225,32.981165,56.9,61.637071,52.155885,15:19:35 29 Jul 2022,-19.95,2022-07-29 15:19:35,Jul. 29
874,Joe Biden,Adults,07-28-22,36.87,40.90103,32.830865,56.89,61.67968,52.102036,15:31:36 28 Jul 2022,-20.02,2022-07-28 15:31:36,Jul. 28
877,Joe Biden,Adults,07-27-22,36.35,40.323816,32.373782,57.21,62.222098,52.201159,10:59:40 27 Jul 2022,-20.86,2022-07-27 10:59:40,Jul. 27
880,Joe Biden,Adults,07-26-22,35.98,40.081839,31.885028,57.71,62.80499,52.616452,20:27:38 26 Jul 2022,-21.73,2022-07-26 20:27:38,Jul. 26
889,Joe Biden,Adults,07-25-22,36.42,40.465429,32.375987,57.23,62.144867,52.313294,10:14:35 25 Jul 2022,-20.81,2022-07-25 10:14:35,Jul. 25
892,Joe Biden,Adults,07-22-22,36.42,40.465433,32.375983,57.23,62.144863,52.313298,20:45:36 22 Jul 2022,-20.81,2022-07-22 20:45:36,Jul. 22
895,Joe Biden,Adults,07-21-22,36.42,40.465429,32.375987,57.23,62.144867,52.313294,15:07:34 21 Jul 2022,-20.81,2022-07-21 15:07:34,Jul. 21
898,Joe Biden,Adults,07-20-22,37.06,41.360112,32.751888,56.46,61.319062,51.607654,20:37:34 20 Jul 2022,-19.41,2022-07-20 20:37:34,Jul. 20
901,Joe Biden,Adults,07-19-22,38.33,41.634835,35.019612,55.3,60.385935,50.222566,09:58:34 19 Jul 2022,-16.98,2022-07-19 09:58:34,Jul. 19
904,Joe Biden,Adults,07-18-22,38.33,41.633334,35.01909,55.3,60.385548,50.223132,16:44:33 18 Jul 2022,-16.98,2022-07-18 16:44:33,Jul. 18
910,Joe Biden,Adults,07-17-22,38.33,41.658123,35.006014,55.29,60.294175,50.287117,12:47:03 17 Jul 2022,-16.96,2022-07-17 12:47:03,Jul. 17
913,Joe Biden,Adults,07-15-22,38.33,41.658123,35.006013,55.29,60.294177,50.287115,15:32:37 15 Jul 2022,-16.96,2022-07-15 15:32:37,Jul. 15
916,Joe Biden,Adults,07-14-22,38.19,41.547225,34.833133,55.48,60.533987,50.420778,14:37:34 14 Jul 2022,-17.29,2022-07-14 14:37:34,Jul. 14
919,Joe Biden,Adults,07-13-22,38.22,41.637186,34.81082,55.63,61.031673,50.226745,14:57:34 13 Jul 2022,-17.41,2022-07-13 14:57:34,Jul. 13
922,Joe Biden,Adults,07-12-22,38.4,41.97509,34.824498,55.13,60.347495,49.906464,16:01:34 12 Jul 2022,-16.73,2022-07-12 16:01:34,Jul. 12
931,Joe Biden,Adults,07-11-22,37.58,41.228163,33.925268,56.21,60.612527,51.809755,10:45:29 11 Jul 2022,-18.63,2022-07-11 10:45:29,Jul. 11
934,Joe Biden,Adults,07-08-22,37.58,41.228168,33.925263,56.21,60.612525,51.809757,12:39:34  8 Jul 2022,-18.63,2022-07-08 12:39:34,Jul. 08
937,Joe Biden,Adults,07-07-22,37.58,41.228166,33.925265,56.21,60.612536,51.809747,15:31:32  7 Jul 2022,-18.63,2022-07-07 15:31:32,Jul. 07
940,Joe Biden,Adults,07-06-22,38.16,41.865322,34.44966,55.67,60.121774,51.226189,16:23:33  6 Jul 2022,-17.52,2022-07-06 16:23:33,Jul. 06
952,Joe Biden,Adults,07-05-22,37.98,41.849062,34.113657,56.09,60.373424,51.798359,11:49:57  5 Jul 2022,-18.1,2022-07-05 11:49:57,Jul. 05
955,Joe Biden,Adults,07-01-22,37.98,41.849062,34.113656,56.09,60.373426,51.798357,10:02:33  1 Jul 2022,-18.1,2022-07-01 10:02:33,Jul. 01
958,Joe Biden,Adults,06-30-22,37.98,41.849062,34.113656,56.09,60.373426,51.798357,14:02:33 30 Jun 2022,-18.1,2022-06-30 14:02:33,Jun. 30
961,Joe Biden,Adults,06-29-22,38.14,42.130326,34.150752,55.86,60.294705,51.421265,21:15:32 29 Jun 2022,-17.72,2022-06-29 21:15:32,Jun. 29
964,Joe Biden,Adults,06-28-22,38.95,43.216352,34.676457,55.39,59.845984,50.924816,09:55:32 28 Jun 2022,-16.44,2022-06-28 09:55:32,Jun. 28
967,Joe Biden,Adults,06-27-22,38.95,43.21603,34.677211,55.39,59.846256,50.925512,18:04:31 27 Jun 2022,-16.44,2022-06-27 18:04:31,Jun. 27
973,Joe Biden,Adults,06-26-22,37.88,42.223605,33.539579,55.3,59.620942,50.972807,12:25:59 26 Jun 2022,-17.42,2022-06-26 12:25:59,Jun. 26
976,Joe Biden,Adults,06-24-22,37.88,42.223594,33.53959,55.3,59.620938,50.972811,17:34:32 24 Jun 2022,-17.42,2022-06-24 17:34:32,Jun. 24
979,Joe Biden,Adults,06-23-22,37.88,42.223605,33.539579,55.3,59.620946,50.972803,22:27:32 23 Jun 2022,-17.42,2022-06-23 22:27:32,Jun. 23
982,Joe Biden,Adults,06-22-22,38.31,42.680747,33.930747,54.75,58.987634,50.521078,16:20:32 22 Jun 2022,-16.45,2022-06-22 16:20:32,Jun. 22
985,Joe Biden,Adults,06-21-22,38.45,42.474266,34.423932,54.55,58.822803,50.285647,20:56:31 21 Jun 2022,-16.11,2022-06-21 20:56:31,Jun. 21
994,Joe Biden,Adults,06-20-22,38.75,42.827742,34.676485,54.17,58.578097,49.756939,09:58:24 20 Jun 2022,-15.42,2022-06-20 09:58:24,Jun. 20
997,Joe Biden,Adults,06-17-22,38.75,42.827735,34.676492,54.17,58.57809,49.756946,12:53:32 17 Jun 2022,-15.42,2022-06-17 12:53:32,Jun. 17
1000,Joe Biden,Adults,06-16-22,38.79,42.958319,34.618344,53.78,58.189452,49.362328,09:34:31 16 Jun 2022,-14.99,2022-06-16 09:34:31,Jun. 16
1003,Joe Biden,Adults,06-15-22,39.03,43.329043,34.729367,53.42,57.971335,48.875992,20:09:31 15 Jun 2022,-14.39,2022-06-15 20:09:31,Jun. 15
1006,Joe Biden,Adults,06-14-22,38.54,43.000983,34.088602,53.5,58.127981,48.872563,19:50:32 14 Jun 2022,-14.96,2022-06-14 19:50:32,Jun. 14
1015,Joe Biden,Adults,06-13-22,39.3,43.850297,34.756807,53.35,57.596339,49.105395,09:36:24 13 Jun 2022,-14.05,2022-06-13 09:36:24,Jun. 13
1018,Joe Biden,Adults,06-10-22,39.3,43.850297,34.756808,53.35,57.596337,49.105397,09:39:31 10 Jun 2022,-14.05,2022-06-10 09:39:31,Jun. 10
1021,Joe Biden,Adults,06-09-22,39.3,43.850295,34.75681,53.35,57.596329,49.105405,09:34:31  9 Jun 2022,-14.05,2022-06-09 09:34:31,Jun. 09
1024,Joe Biden,Adults,06-08-22,39.68,44.538954,34.819131,53.61,58.145581,49.064516,19:47:30  8 Jun 2022,-13.93,2022-06-08 19:47:30,Jun. 08
1027,Joe Biden,Adults,06-07-22,39.91,43.608146,36.204945,54.29,58.9899,49.585259,20:12:30  7 Jun 2022,-14.38,2022-06-07 20:12:30,Jun. 07
1036,Joe Biden,Adults,06-06-22,39.94,43.778884,36.097023,53.98,58.678196,49.288648,09:15:22  6 Jun 2022,-14.05,2022-06-06 09:15:22,Jun. 06
1039,Joe Biden,Adults,06-03-22,39.94,43.778883,36.097023,53.98,58.678194,49.28865,12:35:30  3 Jun 2022,-14.05,2022-06-03 12:35:30,Jun. 03
1042,Joe Biden,Adults,06-02-22,39.91,43.846882,35.964292,53.81,58.490852,49.129725,09:56:30  2 Jun 2022,-13.9,2022-06-02 09:56:30,Jun. 02
1045,Joe Biden,Adults,06-01-22,40.08,44.17118,35.983671,53.65,58.556221,48.744581,20:31:29  1 Jun 2022,-13.57,2022-06-01 20:31:29,Jun. 01
1048,Joe Biden,Adults,05-31-22,39.61,43.599754,35.621892,54.42,59.20667,49.63027,14:35:30 31 May 2022,-14.81,2022-05-31 14:35:30,May. 31
1055,Joe Biden,Adults,05-30-22,39.61,43.599752,35.621894,54.42,59.20668,49.63026,18:47:32 30 May 2022,-14.81,2022-05-30 18:47:32,May. 30
1058,Joe Biden,Adults,05-27-22,39.61,43.599756,35.62189,54.42,59.206679,49.630262,12:19:32 27 May 2022,-14.81,2022-05-27 12:19:32,May. 27
1061,Joe Biden,Adults,05-26-22,39.61,43.599745,35.621901,54.42,59.206673,49.630268,21:07:30 26 May 2022,-14.81,2022-05-26 21:07:30,May. 26
1064,Joe Biden,Adults,05-25-22,39.72,43.853712,35.581935,54.28,59.218723,49.347126,13:29:30 25 May 2022,-14.57,2022-05-25 13:29:30,May. 25
1067,Joe Biden,Adults,05-24-22,39.62,43.829725,35.40513,54.82,59.649962,49.998597,20:24:30 24 May 2022,-15.21,2022-05-24 20:24:30,May. 24
1070,Joe Biden,Adults,05-23-22,40.28,44.386236,36.173263,54.22,58.923822,49.51719,21:28:30 23 May 2022,-13.94,2022-05-23 21:28:30,May. 23
1076,Joe Biden,Adults,05-22-22,39.86,43.884241,35.839905,53.88,58.867182,48.890625,13:07:54 22 May 2022,-14.02,2022-05-22 13:07:54,May. 22
1079,Joe Biden,Adults,05-20-22,39.86,43.884248,35.839898,53.88,58.86719,48.890617,12:59:29 20 May 2022,-14.02,2022-05-20 12:59:29,May. 20
1082,Joe Biden,Adults,05-19-22,40.39,44.502532,36.285451,53.15,57.809819,48.494077,14:50:30 19 May 2022,-12.76,2022-05-19 14:50:30,May. 19
1085,Joe Biden,Adults,05-18-22,40.53,44.854075,36.20299,52.82,57.602354,48.041093,14:09:28 18 May 2022,-12.29,2022-05-18 14:09:28,May. 18
1088,Joe Biden,Adults,05-17-22,40.79,44.596438,36.97537,52.53,57.20191,47.859381,21:29:28 17 May 2022,-11.74,2022-05-17 21:29:28,May. 17
1091,Joe Biden,Adults,05-16-22,40.78,44.529348,37.037512,52.39,57.061139,47.71498,20:06:28 16 May 2022,-11.6,2022-05-16 20:06:28,May. 16
1094,Joe Biden,Adults,05-15-22,40.45,43.942756,36.955874,52.56,57.20914,47.913285,13:30:29 15 May 2022,-12.11,2022-05-15 13:30:29,May. 15
1097,Joe Biden,Adults,05-13-22,40.57,44.09483,37.038762,52.16,56.71518,47.611936,09:40:28 13 May 2022,-11.6,2022-05-13 09:40:28,May. 13
1100,Joe Biden,Adults,05-12-22,40.57,44.094828,37.038764,52.16,56.71517,47.611946,14:27:28 12 May 2022,-11.6,2022-05-12 14:27:28,May. 12
1103,Joe Biden,Adults,05-11-22,41.0,44.522293,37.469909,51.33,55.644949,47.017849,13:49:29 11 May 2022,-10.34,2022-05-11 13:49:29,May. 11
1106,Joe Biden,Adults,05-10-22,41.02,44.573165,37.470095,51.53,56.007968,47.044849,20:39:27 10 May 2022,-10.5,2022-05-10 20:39:27,May. 10
1114,Joe Biden,Adults,05-09-22,42.21,45.917632,38.508935,52.38,56.655589,48.112768,09:47:23  9 May 2022,-10.17,2022-05-09 09:47:23,May. 09
1117,Joe Biden,Adults,05-06-22,41.43,44.989655,37.865605,52.11,56.357642,47.870201,20:26:27  6 May 2022,-10.69,2022-05-06 20:26:27,May. 06
1120,Joe Biden,Adults,05-05-22,41.58,45.141154,38.021602,52.02,56.344255,47.691151,12:28:28  5 May 2022,-10.44,2022-05-05 12:28:28,May. 05
1123,Joe Biden,Adults,05-04-22,41.72,45.382887,38.052847,51.78,56.236457,47.331341,20:01:28  4 May 2022,-10.07,2022-05-04 20:01:28,May. 04
1126,Joe Biden,Adults,05-03-22,41.65,45.505945,37.802493,51.42,55.432957,47.40423,20:05:27  3 May 2022,-9.76,2022-05-03 20:05:27,May. 03
1129,Joe Biden,Adults,05-02-22,41.56,45.232827,37.88271,51.67,55.62984,47.709509,20:08:27  2 May 2022,-10.11,2022-05-02 20:08:27,May. 02
1132,Joe Biden,Adults,05-01-22,41.42,45.079895,37.757841,51.2,55.040819,47.365331,13:25:28  1 May 2022,-9.78,2022-05-01 13:25:28,May. 01
1135,Joe Biden,Adults,04-29-22,41.0,44.768956,37.23403,51.35,55.345011,47.361109,10:26:27 29 Apr 2022,-10.35,2022-04-29 10:26:27,Apr. 29
1138,Joe Biden,Adults,04-28-22,40.79,44.726585,36.852847,51.76,55.936731,47.579582,15:07:27 28 Apr 2022,-10.97,2022-04-28 15:07:27,Apr. 28
1141,Joe Biden,Adults,04-27-22,41.0,45.058808,36.946527,51.64,55.960717,47.32819,19:53:27 27 Apr 2022,-10.64,2022-04-27 19:53:27,Apr. 27
1144,Joe Biden,Adults,04-26-22,40.71,44.977717,36.447488,52.48,57.132912,47.834515,20:32:18 26 Apr 2022,-11.77,2022-04-26 20:32:18,Apr. 26
1153,Joe Biden,Adults,04-25-22,40.51,44.921639,36.105542,52.52,57.324268,47.708529,09:31:48 25 Apr 2022,-12.0,2022-04-25 09:31:48,Apr. 25
1156,Joe Biden,Adults,04-22-22,40.51,44.921633,36.105548,52.52,57.324269,47.708527,14:43:26 22 Apr 2022,-12.0,2022-04-22 14:43:26,Apr. 22
1159,Joe Biden,Adults,04-21-22,40.4,44.782829,36.015903,52.05,56.907432,47.194221,21:01:26 21 Apr 2022,-11.65,2022-04-21 21:01:26,Apr. 21
1162,Joe Biden,Adults,04-20-22,41.27,45.96913,36.566462,51.22,56.358604,46.08147,09:52:26 20 Apr 2022,-9.95,2022-04-20 09:52:26,Apr. 20
1165,Joe Biden,Adults,04-19-22,41.06,46.001522,36.119974,51.4,56.84212,45.949148,15:21:31 19 Apr 2022,-10.33,2022-04-19 15:21:31,Apr. 19
1174,Joe Biden,Adults,04-18-22,40.93,45.718252,36.149371,51.35,56.74569,45.960896,09:28:48 18 Apr 2022,-10.42,2022-04-18 09:28:48,Apr. 18
1177,Joe Biden,Adults,04-15-22,40.93,45.718263,36.14936,51.35,56.745686,45.9609,09:39:25 15 Apr 2022,-10.42,2022-04-15 09:39:25,Apr. 15
1180,Joe Biden,Adults,04-14-22,40.93,45.718258,36.149365,51.35,56.745689,45.960897,09:46:26 14 Apr 2022,-10.42,2022-04-14 09:46:26,Apr. 14
1183,Joe Biden,Adults,04-13-22,41.04,45.965729,36.111248,51.2,56.778455,45.625131,15:42:28 13 Apr 2022,-10.16,2022-04-13 15:42:28,Apr. 13
1186,Joe Biden,Adults,04-12-22,42.08,46.233469,37.922744,51.1,56.884435,45.312902,09:47:25 12 Apr 2022,-9.02,2022-04-12 09:47:25,Apr. 12
1189,Joe Biden,Adults,04-11-22,42.08,46.233466,37.922747,51.1,56.884422,45.312916,20:06:28 11 Apr 2022,-9.02,2022-04-11 20:06:28,Apr. 11
1195,Joe Biden,Adults,04-10-22,41.52,46.00015,37.035328,51.62,55.74165,47.495473,16:06:45 10 Apr 2022,-10.1,2022-04-10 16:06:45,Apr. 10
1198,Joe Biden,Adults,04-08-22,41.52,46.000151,37.035326,51.62,55.741658,47.495466,09:50:25  8 Apr 2022,-10.1,2022-04-08 09:50:25,Apr. 08
1201,Joe Biden,Adults,04-07-22,41.52,46.000146,37.035332,51.62,55.741661,47.495462,22:00:28  7 Apr 2022,-10.1,2022-04-07 22:00:28,Apr. 07
1204,Joe Biden,Adults,04-06-22,41.23,45.717781,36.749614,51.91,55.863524,47.962166,16:34:25  6 Apr 2022,-10.68,2022-04-06 16:34:25,Apr. 06
1207,Joe Biden,Adults,04-05-22,41.1,45.856663,36.348102,52.18,56.502921,47.856015,19:57:24  5 Apr 2022,-11.08,2022-04-05 19:57:24,Apr. 05
1216,Joe Biden,Adults,04-04-22,40.82,45.323737,36.31189,52.27,56.450673,48.09012,09:41:04  4 Apr 2022,-11.45,2022-04-04 09:41:04,Apr. 04
1219,Joe Biden,Adults,04-01-22,40.82,45.323736,36.311891,52.27,56.450671,48.090122,10:19:25  1 Apr 2022,-11.45,2022-04-01 10:19:25,Apr. 01
1222,Joe Biden,Adults,03-31-22,40.86,45.306146,36.407332,52.21,56.35163,48.06646,14:51:25 31 Mar 2022,-11.35,2022-03-31 14:51:25,Mar. 31
1225,Joe Biden,Adults,03-30-22,41.03,45.71659,36.352588,52.16,56.476887,47.834622,14:06:24 30 Mar 2022,-11.12,2022-03-30 14:06:24,Mar. 30
1228,Joe Biden,Adults,03-29-22,41.0,45.593168,36.400772,52.65,56.822858,48.470653,20:15:34 29 Mar 2022,-11.65,2022-03-29 20:15:34,Mar. 29
1231,Joe Biden,Adults,03-28-22,40.8,45.469236,36.121155,52.88,57.102068,48.651213,20:09:25 28 Mar 2022,-12.08,2022-03-28 20:09:25,Mar. 28
1237,Joe Biden,Adults,03-27-22,40.78,45.557126,36.007224,52.74,57.00512,48.477511,13:04:43 27 Mar 2022,-11.96,2022-03-27 13:04:43,Mar. 27
1240,Joe Biden,Adults,03-25-22,40.78,45.557131,36.007219,52.74,57.005117,48.477514,09:42:23 25 Mar 2022,-11.96,2022-03-25 09:42:23,Mar. 25
1243,Joe Biden,Adults,03-24-22,40.78,45.557125,36.007225,52.74,57.00512,48.477511,18:30:34 24 Mar 2022,-11.96,2022-03-24 18:30:34,Mar. 24
1246,Joe Biden,Adults,03-23-22,40.62,45.600443,35.635264,52.2,56.335013,48.070816,20:22:23 23 Mar 2022,-11.59,2022-03-23 20:22:23,Mar. 23
1249,Joe Biden,Adults,03-22-22,41.39,45.736045,37.039099,52.96,57.109862,48.800663,16:32:23 22 Mar 2022,-11.57,2022-03-22 16:32:23,Mar. 22
1252,Joe Biden,Adults,03-21-22,41.86,46.270697,37.45831,52.67,56.847101,48.499395,15:08:23 21 Mar 2022,-10.81,2022-03-21 15:08:23,Mar. 21
1258,Joe Biden,Adults,03-18-22,41.47,45.739398,37.195777,52.89,57.069598,48.705195,09:35:24 18 Mar 2022,-11.42,2022-03-18 09:35:24,Mar. 18
1261,Joe Biden,Adults,03-17-22,41.47,45.739405,37.195771,52.89,57.069595,48.705199,11:50:23 17 Mar 2022,-11.42,2022-03-17 11:50:23,Mar. 17
1264,Joe Biden,Adults,03-16-22,42.25,46.65244,37.839729,52.39,56.742526,48.027773,14:54:23 16 Mar 2022,-10.14,2022-03-16 14:54:23,Mar. 16
1267,Joe Biden,Adults,03-15-22,42.58,46.916557,38.236632,52.33,56.962961,47.700302,21:03:23 15 Mar 2022,-9.76,2022-03-15 21:03:23,Mar. 15
1270,Joe Biden,Adults,03-14-22,42.99,47.749698,38.235533,51.24,55.963083,46.519107,21:52:22 14 Mar 2022,-8.25,2022-03-14 21:52:22,Mar. 14
1276,Joe Biden,Adults,03-13-22,42.76,47.572837,37.938623,50.0,54.265941,45.726808,15:16:40 13 Mar 2022,-7.24,2022-03-13 15:16:40,Mar. 13
1279,Joe Biden,Adults,03-11-22,42.76,47.57283,37.93863,50.0,54.265942,45.726806,09:49:22 11 Mar 2022,-7.24,2022-03-11 09:49:22,Mar. 11
1282,Joe Biden,Adults,03-10-22,42.76,47.572832,37.938629,50.0,54.265945,45.726804,21:46:21 10 Mar 2022,-7.24,2022-03-10 21:46:21,Mar. 10
1285,Joe Biden,Adults,03-09-22,42.96,47.919011,37.99804,49.85,54.235303,45.469842,11:18:21  9 Mar 2022,-6.89,2022-03-09 11:18:21,Mar. 09
1288,Joe Biden,Adults,03-08-22,42.98,48.066113,37.902679,50.26,54.680577,45.836388,19:38:21  8 Mar 2022,-7.27,2022-03-08 19:38:21,Mar. 08
1297,Joe Biden,Adults,03-07-22,43.08,47.874339,38.282993,51.58,55.780242,47.373377,08:58:56  7 Mar 2022,-8.5,2022-03-07 08:58:56,Mar. 07
1300,Joe Biden,Adults,03-04-22,43.08,47.874332,38.282999,51.58,55.780237,47.373382,12:25:21  4 Mar 2022,-8.5,2022-03-04 12:25:21,Mar. 04
1303,Joe Biden,Adults,03-03-22,41.39,45.765325,37.017551,52.49,56.723074,48.25229,10:01:21  3 Mar 2022,-11.1,2022-03-03 10:01:21,Mar. 03
1306,Joe Biden,Adults,03-02-22,41.41,45.887303,36.932195,52.59,56.839646,48.339641,21:33:21  2 Mar 2022,-11.18,2022-03-02 21:33:21,Mar. 02
1309,Joe Biden,Adults,03-01-22,41.25,45.785255,36.705435,53.14,57.055512,49.225661,20:24:21  1 Mar 2022,-11.9,2022-03-01 20:24:21,Mar. 01
1312,Joe Biden,Adults,02-28-22,40.82,45.25621,36.38809,52.7,56.57315,48.81985,17:03:13 28 Feb 2022,-11.87,2022-02-28 17:03:13,Feb. 28
1318,Joe Biden,Adults,02-27-22,41.44,45.618408,37.251816,52.97,57.139121,48.800819,13:01:43 27 Feb 2022,-11.53,2022-02-27 13:01:43,Feb. 27
1321,Joe Biden,Adults,02-25-22,41.44,45.618409,37.251816,52.97,57.139124,48.800817,16:28:21 25 Feb 2022,-11.53,2022-02-25 16:28:21,Feb. 25
1324,Joe Biden,Adults,02-24-22,41.39,45.631082,37.146152,53.02,57.327564,48.707459,21:56:22 24 Feb 2022,-11.63,2022-02-24 21:56:22,Feb. 24
1327,Joe Biden,Adults,02-23-22,41.42,45.951648,36.885448,52.74,57.236688,48.24359,15:34:21 23 Feb 2022,-11.32,2022-02-23 15:34:21,Feb. 23
1333,Joe Biden,Adults,02-22-22,41.36,46.040622,36.689088,53.27,57.915676,48.616949,09:09:39 22 Feb 2022,-11.9,2022-02-22 09:09:39,Feb. 22
1339,Joe Biden,Adults,02-20-22,40.8,45.488951,36.116451,52.43,56.764696,48.102951,13:15:38 20 Feb 2022,-11.63,2022-02-20 13:15:38,Feb. 20
1342,Joe Biden,Adults,02-18-22,40.8,45.48896,36.116442,52.43,56.764706,48.102941,13:15:22 18 Feb 2022,-11.63,2022-02-18 13:15:22,Feb. 18
1345,Joe Biden,Adults,02-17-22,40.8,45.488951,36.116451,52.43,56.764696,48.102951,14:52:33 17 Feb 2022,-11.63,2022-02-17 14:52:33,Feb. 17
1348,Joe Biden,Adults,02-16-22,40.87,45.694204,36.037423,52.52,56.957917,48.089644,14:03:21 16 Feb 2022,-11.66,2022-02-16 14:03:21,Feb. 16
1351,Joe Biden,Adults,02-15-22,41.51,45.674196,37.349016,52.62,57.201315,48.029107,20:46:22 15 Feb 2022,-11.1,2022-02-15 20:46:22,Feb. 15
1354,Joe Biden,Adults,02-14-22,41.54,45.50776,37.566351,52.88,57.383565,48.378503,09:39:20 14 Feb 2022,-11.34,2022-02-14 09:39:20,Feb. 14
1360,Joe Biden,Adults,02-13-22,40.7,44.580107,36.818265,52.02,56.287629,47.748122,13:12:38 13 Feb 2022,-11.32,2022-02-13 13:12:38,Feb. 13
1363,Joe Biden,Adults,02-11-22,40.7,44.580098,36.818274,52.02,56.287618,47.748133,13:21:20 11 Feb 2022,-11.32,2022-02-11 13:21:20,Feb. 11
1366,Joe Biden,Adults,02-10-22,40.7,44.580116,36.818256,52.02,56.287627,47.748124,16:31:22 10 Feb 2022,-11.32,2022-02-10 16:31:22,Feb. 10
1369,Joe Biden,Adults,02-09-22,40.86,44.899128,36.82569,51.83,56.101082,47.555899,21:39:20  9 Feb 2022,-10.97,2022-02-09 21:39:20,Feb. 09
1372,Joe Biden,Adults,02-08-22,40.59,44.75328,36.420533,52.31,56.899136,47.71101,19:56:21  8 Feb 2022,-11.72,2022-02-08 19:56:21,Feb. 08
1381,Joe Biden,Adults,02-07-22,41.23,45.324089,37.142374,52.77,57.135225,48.396131,09:45:52  7 Feb 2022,-11.53,2022-02-07 09:45:52,Feb. 07
1384,Joe Biden,Adults,02-04-22,41.23,45.324079,37.142383,52.77,57.135226,48.39613,09:34:21  4 Feb 2022,-11.53,2022-02-04 09:34:21,Feb. 04
1387,Joe Biden,Adults,02-03-22,41.23,45.324089,37.142374,52.77,57.135225,48.396131,20:47:20  3 Feb 2022,-11.53,2022-02-03 20:47:20,Feb. 03
1390,Joe Biden,Adults,02-02-22,41.87,46.125909,37.607824,52.04,56.406953,47.679324,14:50:21  2 Feb 2022,-10.18,2022-02-02 14:50:21,Feb. 02
1393,Joe Biden,Adults,02-01-22,41.58,45.934187,37.234388,52.51,56.695785,48.314842,11:28:20  1 Feb 2022,-10.92,2022-02-01 11:28:20,Feb. 01
1399,Joe Biden,Adults,01-31-22,41.58,45.934188,37.234388,52.51,56.695797,48.31483,09:46:35 31 Jan 2022,-10.92,2022-01-31 09:46:35,Jan. 31
1402,Joe Biden,Adults,01-29-22,41.58,45.934178,37.234398,52.51,56.695786,48.314841,20:44:20 29 Jan 2022,-10.92,2022-01-29 20:44:20,Jan. 29
1405,Joe Biden,Adults,01-28-22,41.58,46.019669,37.144522,52.34,56.493579,48.194076,14:12:20 28 Jan 2022,-10.76,2022-01-28 14:12:20,Jan. 28
1408,Joe Biden,Adults,01-27-22,41.72,46.345496,37.102304,52.43,56.674655,48.186281,20:52:20 27 Jan 2022,-10.71,2022-01-27 20:52:20,Jan. 27
1411,Joe Biden,Adults,01-26-22,41.21,45.672778,36.745547,52.73,57.058659,48.397772,18:51:19 26 Jan 2022,-11.52,2022-01-26 18:51:19,Jan. 26
1414,Joe Biden,Adults,01-25-22,42.12,46.424387,37.817832,53.03,57.569846,48.491691,14:31:20 25 Jan 2022,-10.91,2022-01-25 14:31:20,Jan. 25
1417,Joe Biden,Adults,01-24-22,41.71,46.172447,37.243866,52.79,57.466565,48.122303,19:55:20 24 Jan 2022,-11.09,2022-01-24 19:55:20,Jan. 24
1423,Joe Biden,Adults,01-23-22,41.71,46.172447,37.243866,52.79,57.466565,48.122303,12:42:34 23 Jan 2022,-11.09,2022-01-23 12:42:34,Jan. 23
1426,Joe Biden,Adults,01-21-22,41.71,46.172447,37.243866,52.79,57.466565,48.122303,09:40:20 21 Jan 2022,-11.09,2022-01-21 09:40:20,Jan. 21
1429,Joe Biden,Adults,01-20-22,41.76,46.356604,37.167129,52.54,57.355238,47.722956,21:04:19 20 Jan 2022,-10.78,2022-01-20 21:04:19,Jan. 20
1432,Joe Biden,Adults,01-19-22,41.75,47.03441,36.458802,51.53,56.538476,46.512222,17:31:19 19 Jan 2022,-9.78,2022-01-19 17:31:19,Jan. 19
1435,Joe Biden,Adults,01-18-22,42.27,47.525563,37.012073,51.87,56.97401,46.759181,20:35:19 18 Jan 2022,-9.6,2022-01-18 20:35:19,Jan. 18
1438,Joe Biden,Adults,01-17-22,42.5,47.916046,37.08207,51.39,56.369216,46.41308,12:18:18 17 Jan 2022,-8.89,2022-01-17 12:18:18,Jan. 17
1444,Joe Biden,Adults,01-16-22,41.92,47.525126,36.314459,50.36,54.699497,46.022983,13:18:32 16 Jan 2022,-8.44,2022-01-16 13:18:32,Jan. 16
1447,Joe Biden,Adults,01-14-22,41.92,47.525126,36.314459,50.36,54.699497,46.022983,14:09:19 14 Jan 2022,-8.44,2022-01-14 14:09:19,Jan. 14
1450,Joe Biden,Adults,01-13-22,41.92,47.525126,36.314459,50.36,54.699497,46.022983,20:36:18 13 Jan 2022,-8.44,2022-01-13 20:36:18,Jan. 13
1453,Joe Biden,Adults,01-12-22,41.65,47.409903,35.886848,50.4,54.957321,45.843482,14:17:19 12 Jan 2022,-8.75,2022-01-12 14:17:19,Jan. 12
1456,Joe Biden,Adults,01-11-22,42.87,46.906508,38.832121,50.12,54.572749,45.665161,09:54:18 11 Jan 2022,-7.25,2022-01-11 09:54:18,Jan. 11
1465,Joe Biden,Adults,01-10-22,42.57,47.006502,38.12739,50.49,53.989295,46.999965,09:32:44 10 Jan 2022,-7.93,2022-01-10 09:32:44,Jan. 10
1468,Joe Biden,Adults,01-07-22,42.57,47.006502,38.12739,50.49,53.989295,46.999965,10:50:19  7 Jan 2022,-7.93,2022-01-07 10:50:19,Jan. 07
1471,Joe Biden,Adults,01-06-22,42.55,46.997562,38.106784,50.35,53.944773,46.750197,16:19:18  6 Jan 2022,-7.8,2022-01-06 16:19:18,Jan. 06
1474,Joe Biden,Adults,01-05-22,43.09,48.381362,37.793357,50.11,54.186402,46.034119,11:52:18  5 Jan 2022,-7.02,2022-01-05 11:52:18,Jan. 05
1477,Joe Biden,Adults,01-04-22,43.38,48.227468,38.539626,50.11,54.598575,45.627662,14:18:18  4 Jan 2022,-6.73,2022-01-04 14:18:18,Jan. 04
1486,Joe Biden,Adults,01-03-22,43.38,48.227697,38.539558,50.11,54.598622,45.627132,09:43:42  3 Jan 2022,-6.73,2022-01-03 09:43:42,Jan. 03
1489,Joe Biden,Adults,12-31-21,43.38,48.227697,38.539558,50.11,54.598622,45.627132,09:12:18 31 Dec 2021,-6.73,2021-12-31 09:12:18,Dec. 31
1492,Joe Biden,Adults,12-30-21,43.38,48.227697,38.539558,50.11,54.598622,45.627132,09:43:17 30 Dec 2021,-6.73,2021-12-30 09:43:17,Dec. 30
1495,Joe Biden,Adults,12-29-21,43.18,47.972546,38.397256,50.17,54.764086,45.581782,09:33:18 29 Dec 2021,-6.99,2021-12-29 09:33:18,Dec. 29
1498,Joe Biden,Adults,12-28-21,43.18,47.972546,38.397256,50.17,54.764086,45.581782,09:38:18 28 Dec 2021,-6.99,2021-12-28 09:38:18,Dec. 28
1510,Joe Biden,Adults,12-27-21,43.18,47.972546,38.397256,50.17,54.764086,45.581782,08:50:56 27 Dec 2021,-6.99,2021-12-27 08:50:56,Dec. 27
1513,Joe Biden,Adults,12-23-21,43.18,47.972546,38.397256,50.17,54.764086,45.581782,15:05:18 23 Dec 2021,-6.99,2021-12-23 15:05:18,Dec. 23
1516,Joe Biden,Adults,12-22-21,43.2,48.023481,38.369112,50.17,54.772466,45.564916,12:21:18 22 Dec 2021,-6.97,2021-12-22 12:21:18,Dec. 22
1519,Joe Biden,Adults,12-21-21,43.71,48.332894,39.096084,50.44,55.175257,45.712997,20:53:17 21 Dec 2021,-6.73,2021-12-21 20:53:17,Dec. 21
1528,Joe Biden,Adults,12-20-21,43.83,48.662169,39.005238,49.39,53.826096,44.963845,09:28:42 20 Dec 2021,-5.56,2021-12-20 09:28:42,Dec. 20
1531,Joe Biden,Adults,12-17-21,43.83,48.662197,39.00521,49.39,53.826126,44.963815,16:48:16 17 Dec 2021,-5.56,2021-12-17 16:48:16,Dec. 17
1534,Joe Biden,Adults,12-16-21,43.48,48.15934,38.809639,49.79,54.107291,45.46545,15:07:17 16 Dec 2021,-6.3,2021-12-16 15:07:17,Dec. 16
1537,Joe Biden,Adults,12-15-21,43.58,48.405819,38.744634,49.7,54.124321,45.275716,20:27:17 15 Dec 2021,-6.12,2021-12-15 20:27:17,Dec. 15
1540,Joe Biden,Adults,12-14-21,43.3,47.921243,38.673633,49.65,54.286784,45.004899,14:02:18 14 Dec 2021,-6.35,2021-12-14 14:02:18,Dec. 14
1549,Joe Biden,Adults,12-13-21,43.3,47.921243,38.673633,49.65,54.286784,45.004899,09:38:40 13 Dec 2021,-6.35,2021-12-13 09:38:40,Dec. 13
1552,Joe Biden,Adults,12-10-21,43.3,47.921215,38.673661,49.65,54.286754,45.004929,21:00:21 10 Dec 2021,-6.35,2021-12-10 21:00:21,Dec. 10
1555,Joe Biden,Adults,12-09-21,42.75,47.05754,38.438705,49.99,54.696564,45.281418,13:02:17  9 Dec 2021,-7.24,2021-12-09 13:02:17,Dec. 09
1558,Joe Biden,Adults,12-08-21,42.62,46.903693,38.327317,49.68,54.823783,44.530952,11:56:16  8 Dec 2021,-7.06,2021-12-08 11:56:16,Dec. 08
1561,Joe Biden,Adults,12-07-21,43.47,47.47884,39.455754,49.59,55.02998,44.143956,20:13:16  7 Dec 2021,-6.12,2021-12-07 20:13:16,Dec. 07
1570,Joe Biden,Adults,12-06-21,43.16,47.528683,38.796784,50.37,54.332591,46.39928,09:39:39  6 Dec 2021,-7.2,2021-12-06 09:39:39,Dec. 06
1573,Joe Biden,Adults,12-03-21,43.16,47.528712,38.796755,50.37,54.332623,46.399249,09:31:16  3 Dec 2021,-7.2,2021-12-03 09:31:16,Dec. 03
1576,Joe Biden,Adults,12-02-21,43.16,47.528712,38.796755,50.37,54.332623,46.399249,21:34:16  2 Dec 2021,-7.2,2021-12-02 21:34:16,Dec. 02
1579,Joe Biden,Adults,12-01-21,43.03,47.529308,38.535439,50.47,54.598804,46.345647,13:15:16  1 Dec 2021,-7.44,2021-12-01 13:15:16,Dec. 01
1582,Joe Biden,Adults,11-30-21,43.17,47.788477,38.545324,50.76,55.047606,46.470149,20:29:31 30 Nov 2021,-7.59,2021-11-30 20:29:31,Nov. 30
1597,Joe Biden,Adults,11-29-21,42.99,47.322284,38.665263,50.73,54.791611,46.659848,09:18:00 29 Nov 2021,-7.73,2021-11-29 09:18:00,Nov. 29
1600,Joe Biden,Adults,11-24-21,42.99,47.322313,38.665234,50.73,54.791642,46.659816,11:41:16 24 Nov 2021,-7.73,2021-11-24 11:41:16,Nov. 24
1603,Joe Biden,Adults,11-23-21,43.12,47.687779,38.545224,51.49,55.712429,47.27744,20:21:15 23 Nov 2021,-8.38,2021-11-23 20:21:15,Nov. 23
1606,Joe Biden,Adults,11-22-21,42.95,47.697802,38.208945,51.41,55.813885,47.012256,14:23:15 22 Nov 2021,-8.46,2021-11-22 14:23:15,Nov. 22
1612,Joe Biden,Adults,11-21-21,42.6,47.521686,37.670142,50.74,54.867069,46.612632,13:25:27 21 Nov 2021,-8.14,2021-11-21 13:25:27,Nov. 21
1615,Joe Biden,Adults,11-19-21,42.6,47.521686,37.670142,50.74,54.867069,46.612632,14:55:16 19 Nov 2021,-8.14,2021-11-19 14:55:16,Nov. 19
1618,Joe Biden,Adults,11-18-21,42.57,47.497593,37.652139,50.73,54.865547,46.59851,21:20:17 18 Nov 2021,-8.16,2021-11-18 21:20:17,Nov. 18
1621,Joe Biden,Adults,11-17-21,43.5,47.642289,39.360904,50.42,54.569763,46.275697,09:39:16 17 Nov 2021,-6.92,2021-11-17 09:39:16,Nov. 17
1624,Joe Biden,Adults,11-16-21,43.38,47.659551,39.107258,50.78,54.992847,46.560527,09:42:15 16 Nov 2021,-7.39,2021-11-16 09:42:15,Nov. 16
1627,Joe Biden,Adults,11-15-21,43.35,47.641352,39.060976,50.72,54.955779,46.485995,20:17:15 15 Nov 2021,-7.37,2021-11-15 20:17:15,Nov. 15
1633,Joe Biden,Adults,11-14-21,43.62,48.009714,39.223902,49.97,54.116964,45.826675,13:13:25 14 Nov 2021,-6.36,2021-11-14 13:13:25,Nov. 14
1636,Joe Biden,Adults,11-12-21,43.62,48.009714,39.223902,49.97,54.116964,45.826675,16:09:14 12 Nov 2021,-6.36,2021-11-12 16:09:14,Nov. 12
1639,Joe Biden,Adults,11-11-21,43.62,48.009714,39.223902,49.97,54.116964,45.826675,12:28:15 11 Nov 2021,-6.36,2021-11-11 12:28:15,Nov. 11
1642,Joe Biden,Adults,11-10-21,43.69,48.206804,39.1799,49.84,54.079967,45.591591,20:20:16 10 Nov 2021,-6.14,2021-11-10 20:20:16,Nov. 10
1645,Joe Biden,Adults,11-09-21,43.77,48.634066,38.905898,50.21,54.784489,45.631084,09:39:15  9 Nov 2021,-6.44,2021-11-09 09:39:15,Nov. 09
1648,Joe Biden,Adults,11-08-21,43.65,48.645132,38.658416,49.69,54.077745,45.3108,12:50:15  8 Nov 2021,-6.04,2021-11-08 12:50:15,Nov. 08
1654,Joe Biden,Adults,11-07-21,43.23,48.179146,38.274151,49.51,53.890469,45.131368,13:54:28  7 Nov 2021,-6.28,2021-11-07 13:54:28,Nov. 07
1657,Joe Biden,Adults,11-05-21,43.23,48.179146,38.274151,49.51,53.890469,45.131368,13:00:20  5 Nov 2021,-6.28,2021-11-05 13:00:20,Nov. 05
1660,Joe Biden,Adults,11-04-21,43.23,48.17918,38.274118,49.51,53.890508,45.13133,20:33:28  4 Nov 2021,-6.28,2021-11-04 20:33:28,Nov. 04
1663,Joe Biden,Adults,11-03-21,42.92,47.829437,38.007546,49.79,54.228242,45.342651,11:58:14  3 Nov 2021,-6.87,2021-11-03 11:58:14,Nov. 03
1666,Joe Biden,Adults,11-02-21,43.08,48.05767,38.10294,49.74,54.30236,45.17045,11:58:15  2 Nov 2021,-6.66,2021-11-02 11:58:15,Nov. 02
1669,Joe Biden,Adults,11-01-21,42.96,47.84579,38.0683,49.7,54.19978,45.19582,13:58:14  1 Nov 2021,-6.74,2021-11-01 13:58:14,Nov. 01
1672,Joe Biden,Adults,10-31-21,43.39,48.19471,38.57981,50.37,54.67816,46.05935,12:39:14 31 Oct 2021,-6.98,2021-10-31 12:39:14,Oct. 31
1675,Joe Biden,Adults,10-30-21,43.36,48.2936,38.43287,49.93,54.10301,45.75431,10:46:14 30 Oct 2021,-6.57,2021-10-30 10:46:14,Oct. 30
1678,Joe Biden,Adults,10-29-21,43.36,48.29357,38.4329,49.93,54.10297,45.75436,13:50:14 29 Oct 2021,-6.57,2021-10-29 13:50:14,Oct. 29
1681,Joe Biden,Adults,10-28-21,43.36,48.2936,38.43287,49.93,54.10301,45.75431,21:13:14 28 Oct 2021,-6.57,2021-10-28 21:13:14,Oct. 28
1684,Joe Biden,Adults,10-27-21,43.09,48.17592,38.01147,49.51,53.91731,45.09698,18:12:03 27 Oct 2021,-6.41,2021-10-27 18:12:03,Oct. 27
1687,Joseph R. Biden Jr.,Adults,10-26-21,42.93,48.138978,37.715725,49.52,54.027718,45.004914,09:40:13 26 Oct 2021,-6.59,2021-10-26 09:40:13,Oct. 26
1696,Joseph R. Biden Jr.,Adults,10-25-21,42.72,48.167347,37.280347,48.95,53.39369,44.496407,09:47:30 25 Oct 2021,-6.22,2021-10-25 09:47:30,Oct. 25
1699,Joseph R. Biden Jr.,Adults,10-22-21,42.72,48.167383,37.280311,48.95,53.393731,44.496366,20:48:12 22 Oct 2021,-6.22,2021-10-22 20:48:12,Oct. 22
1702,Joseph R. Biden Jr.,Adults,10-21-21,42.71,48.233176,37.19033,48.99,53.560886,44.4181,17:15:15 21 Oct 2021,-6.28,2021-10-21 17:15:15,Oct. 21
1705,Joseph R. Biden Jr.,Adults,10-20-21,42.82,48.592388,37.043368,48.93,53.717564,44.133423,20:39:12 20 Oct 2021,-6.11,2021-10-20 20:39:12,Oct. 20
1708,Joseph R. Biden Jr.,Adults,10-19-21,43.85,49.715136,37.976513,49.29,54.396375,44.186638,16:01:13 19 Oct 2021,-5.45,2021-10-19 16:01:13,Oct. 19
1717,Joseph R. Biden Jr.,Adults,10-18-21,45.01,50.09462,39.929302,48.83,53.967463,43.687314,09:16:30 18 Oct 2021,-3.82,2021-10-18 09:16:30,Oct. 18
1720,Joseph R. Biden Jr.,Adults,10-15-21,45.01,50.094582,39.92934,48.83,53.96742,43.687357,13:12:13 15 Oct 2021,-3.82,2021-10-15 13:12:13,Oct. 15
1723,Joseph R. Biden Jr.,Adults,10-14-21,44.97,50.0619,39.885275,48.82,53.981062,43.663305,21:09:13 14 Oct 2021,-3.85,2021-10-14 21:09:13,Oct. 14
1726,Joseph R. Biden Jr.,Adults,10-13-21,44.93,50.201202,39.666319,48.77,54.11574,43.417333,12:47:12 13 Oct 2021,-3.83,2021-10-13 12:47:12,Oct. 13
1729,Joseph R. Biden Jr.,Adults,10-12-21,45.01,50.069433,39.95672,48.18,53.712793,42.644506,09:33:13 12 Oct 2021,-3.17,2021-10-12 09:33:13,Oct. 12
1732,Joseph R. Biden Jr.,Adults,10-11-21,45.01,50.069396,39.956758,48.18,53.712749,42.644549,14:30:16 11 Oct 2021,-3.17,2021-10-11 14:30:16,Oct. 11
1738,Joseph R. Biden Jr.,Adults,10-10-21,43.73,48.572824,38.893213,48.0,53.674144,42.330554,12:59:20 10 Oct 2021,-4.27,2021-10-10 12:59:20,Oct. 10
1741,Joseph R. Biden Jr.,Adults,10-08-21,43.73,48.572824,38.893213,48.0,53.674144,42.330554,14:03:13  8 Oct 2021,-4.27,2021-10-08 14:03:13,Oct. 08
1744,Joseph R. Biden Jr.,Adults,10-07-21,43.73,48.572786,38.893251,48.0,53.674101,42.330597,21:01:12  7 Oct 2021,-4.27,2021-10-07 21:01:12,Oct. 07
1747,Joseph R. Biden Jr.,Adults,10-06-21,43.38,48.137254,38.619542,48.18,53.99141,42.371904,20:00:13  6 Oct 2021,-4.8,2021-10-06 20:00:13,Oct. 06
1750,Joseph R. Biden Jr.,Adults,10-05-21,44.59,48.822188,40.358303,46.89,52.829,40.942859,20:25:12  5 Oct 2021,-2.3,2021-10-05 20:25:12,Oct. 05
1753,Joseph R. Biden Jr.,Adults,10-04-21,44.65,48.869899,40.438837,46.64,52.528847,40.750177,13:15:11  4 Oct 2021,-1.99,2021-10-04 13:15:11,Oct. 04
1759,Joseph R. Biden Jr.,Adults,10-03-21,44.8,49.267677,40.339763,47.75,53.030839,42.473887,20:34:20  3 Oct 2021,-2.95,2021-10-03 20:34:20,Oct. 03
1762,Joseph R. Biden Jr.,Adults,10-01-21,44.8,49.267677,40.339763,47.75,53.030839,42.473887,10:23:11  1 Oct 2021,-2.95,2021-10-01 10:23:11,Oct. 01
1765,Joseph R. Biden Jr.,Adults,09-30-21,44.54,48.779503,40.30906,47.71,53.190446,42.230321,23:12:12 30 Sep 2021,-3.17,2021-09-30 23:12:12,Sep. 30
1768,Joseph R. Biden Jr.,Adults,09-29-21,44.42,48.950277,39.89892,48.2,54.086808,42.309027,09:51:10 29 Sep 2021,-3.77,2021-09-29 09:51:10,Sep. 29
1771,Joseph R. Biden Jr.,Adults,09-28-21,44.92,48.988322,40.853871,48.08,54.045708,42.119189,09:39:12 28 Sep 2021,-3.16,2021-09-28 09:39:12,Sep. 28
1780,Joseph R. Biden Jr.,Adults,09-27-21,44.87,48.923542,40.817871,48.12,54.091534,42.152934,09:35:51 27 Sep 2021,-3.25,2021-09-27 09:35:51,Sep. 27
1783,Joseph R. Biden Jr.,Adults,09-24-21,44.87,48.923501,40.817912,48.12,54.091483,42.152985,14:49:10 24 Sep 2021,-3.25,2021-09-24 14:49:10,Sep. 24
1786,Joseph R. Biden Jr.,Adults,09-23-21,45.22,49.251772,41.188433,47.48,53.365515,41.58487,14:35:10 23 Sep 2021,-2.26,2021-09-23 14:35:10,Sep. 23
1789,Joseph R. Biden Jr.,Adults,09-22-21,45.94,50.319715,41.552406,47.75,52.544759,42.962307,17:27:10 22 Sep 2021,-1.82,2021-09-22 17:27:10,Sep. 22
1792,Joseph R. Biden Jr.,Adults,09-21-21,46.18,50.751326,41.599666,47.57,52.44096,42.692043,16:18:11 21 Sep 2021,-1.39,2021-09-21 16:18:11,Sep. 21
1795,Joseph R. Biden Jr.,Adults,09-20-21,45.63,49.943857,41.310945,47.77,52.719239,42.826264,13:32:11 20 Sep 2021,-2.15,2021-09-20 13:32:11,Sep. 20
1801,Joseph R. Biden Jr.,Adults,09-19-21,45.52,49.816727,41.225437,47.81,52.754575,42.871149,13:37:16 19 Sep 2021,-2.29,2021-09-19 13:37:16,Sep. 19
1804,Joseph R. Biden Jr.,Adults,09-17-21,45.52,49.816727,41.225437,47.81,52.754575,42.871149,13:01:56 17 Sep 2021,-2.29,2021-09-17 13:01:56,Sep. 17
1807,Joseph R. Biden Jr.,Adults,09-16-21,45.45,49.752337,41.152388,47.75,52.716586,42.787076,19:01:10 16 Sep 2021,-2.3,2021-09-16 19:01:10,Sep. 16
1810,Joseph R. Biden Jr.,Adults,09-15-21,45.49,50.078693,40.90806,47.61,52.853442,42.373786,14:20:10 15 Sep 2021,-2.12,2021-09-15 14:20:10,Sep. 15
1813,Joseph R. Biden Jr.,Adults,09-14-21,45.56,50.268778,40.846693,47.69,53.049536,42.32367,14:59:10 14 Sep 2021,-2.13,2021-09-14 14:59:10,Sep. 14
1822,Joseph R. Biden Jr.,Adults,09-13-21,45.58,50.289658,40.874291,46.95,52.500638,41.393652,08:56:22 13 Sep 2021,-1.37,2021-09-13 08:56:22,Sep. 13
1825,Joseph R. Biden Jr.,Adults,09-10-21,45.58,50.286749,40.87206,46.95,52.500158,41.393676,18:35:10 10 Sep 2021,-1.37,2021-09-10 18:35:10,Sep. 10
1828,Joseph R. Biden Jr.,Adults,09-09-21,44.38,48.973546,39.789109,46.61,52.229658,40.986924,21:02:11  9 Sep 2021,-2.23,2021-09-09 21:02:11,Sep. 09
1831,Joseph R. Biden Jr.,Adults,09-08-21,44.27,49.143973,39.392043,48.08,52.91223,43.242263,09:25:10  8 Sep 2021,-3.81,2021-09-08 09:25:10,Sep. 08
1834,Joseph R. Biden Jr.,Adults,09-07-21,44.97,49.41532,40.531551,47.7,52.454049,42.94102,18:34:11  7 Sep 2021,-2.72,2021-09-07 18:34:11,Sep. 07
1843,Joseph R. Biden Jr.,Adults,09-06-21,45.63,50.218188,41.032803,48.07,52.740562,43.403697,09:56:22  6 Sep 2021,-2.45,2021-09-06 09:56:22,Sep. 06
1846,Joseph R. Biden Jr.,Adults,09-03-21,45.62,50.214395,41.021141,48.08,52.749302,43.406912,10:34:10  3 Sep 2021,-2.46,2021-09-03 10:34:10,Sep. 03
1849,Joseph R. Biden Jr.,Adults,09-02-21,46.62,51.366796,41.878631,47.02,51.658482,42.38656,20:05:10  2 Sep 2021,-0.4,2021-09-02 20:05:10,Sep. 02
1852,Joseph R. Biden Jr.,Adults,09-01-21,48.17,52.632635,43.710681,45.53,49.788347,41.273706,21:04:10  1 Sep 2021,2.64,2021-09-01 21:04:10,Sep. 01
1855,Joseph R. Biden Jr.,Adults,08-31-21,48.52,52.795961,44.248257,45.94,50.328984,41.554847,21:06:10 31 Aug 2021,2.58,2021-08-31 21:06:10,Aug. 31
1864,Joseph R. Biden Jr.,Adults,08-30-21,48.48,52.796987,44.154072,45.63,50.070669,41.195863,08:13:21 30 Aug 2021,2.84,2021-08-30 08:13:21,Aug. 30
1867,Joseph R. Biden Jr.,Adults,08-27-21,48.48,52.796987,44.154072,45.63,50.070669,41.195863,09:39:10 27 Aug 2021,2.84,2021-08-27 09:39:10,Aug. 27
1870,Joseph R. Biden Jr.,Adults,08-26-21,48.48,52.796987,44.154072,45.63,50.070669,41.195863,20:26:09 26 Aug 2021,2.84,2021-08-26 20:26:09,Aug. 26
1873,Joseph R. Biden Jr.,Adults,08-25-21,48.78,53.233469,44.324154,45.56,50.165136,40.952642,10:29:09 25 Aug 2021,3.22,2021-08-25 10:29:09,Aug. 25
1876,Joseph R. Biden Jr.,Adults,08-24-21,49.02,53.462607,44.577737,45.92,50.672888,41.175726,19:09:09 24 Aug 2021,3.1,2021-08-24 19:09:09,Aug. 24
1879,Joseph R. Biden Jr.,Adults,08-23-21,48.92,53.301931,44.540054,46.01,50.718091,41.306606,15:00:11 23 Aug 2021,2.91,2021-08-23 15:00:11,Aug. 23
1882,Joseph R. Biden Jr.,Adults,08-22-21,49.19,53.673316,44.70968,45.77,50.584668,40.960399,09:28:09 22 Aug 2021,3.42,2021-08-22 09:28:09,Aug. 22
1885,Joseph R. Biden Jr.,Adults,08-21-21,48.6,53.377856,43.82005,44.63,49.19826,40.060325,14:36:09 21 Aug 2021,3.97,2021-08-21 14:36:09,Aug. 21
1888,Joseph R. Biden Jr.,Adults,08-20-21,48.44,53.081122,43.789207,44.33,49.015796,39.650369,17:28:09 20 Aug 2021,4.1,2021-08-20 17:28:09,Aug. 20
1891,Joseph R. Biden Jr.,Adults,08-19-21,48.85,53.594693,44.103366,43.59,48.039494,39.141259,16:39:09 19 Aug 2021,5.26,2021-08-19 16:39:09,Aug. 19
1894,Joseph R. Biden Jr.,Adults,08-18-21,49.16,54.038793,44.284336,43.57,48.070596,39.061447,18:34:08 18 Aug 2021,5.6,2021-08-18 18:34:08,Aug. 18
1897,Joseph R. Biden Jr.,Adults,08-17-21,49.94,54.567788,45.304458,43.02,47.636585,38.403757,20:18:08 17 Aug 2021,6.92,2021-08-17 20:18:08,Aug. 17
1906,Joseph R. Biden Jr.,Adults,08-16-21,49.78,54.55097,45.00867,42.34,46.922895,37.75911,09:37:20 16 Aug 2021,7.44,2021-08-16 09:37:20,Aug. 16
1909,Joseph R. Biden Jr.,Adults,08-13-21,49.78,54.55097,45.00867,42.34,46.922895,37.75911,19:08:08 13 Aug 2021,7.44,2021-08-13 19:08:08,Aug. 13
1912,Joseph R. Biden Jr.,Adults,08-12-21,49.64,54.341096,44.936347,42.43,47.001292,37.855609,19:50:10 12 Aug 2021,7.21,2021-08-12 19:50:10,Aug. 12
1915,Joseph R. Biden Jr.,Adults,08-11-21,49.7,54.671373,44.732307,42.12,46.785044,37.448271,18:36:09 11 Aug 2021,7.59,2021-08-11 18:36:09,Aug. 11
1918,Joseph R. Biden Jr.,Adults,08-10-21,50.11,54.889776,45.327967,42.07,46.823863,37.317827,20:19:09 10 Aug 2021,8.04,2021-08-10 20:19:09,Aug. 10
1927,Joseph R. Biden Jr.,Adults,08-09-21,50.11,54.889776,45.327967,42.07,46.823863,37.317827,09:34:19  9 Aug 2021,8.04,2021-08-09 09:34:19,Aug. 09
1930,Joseph R. Biden Jr.,Adults,08-06-21,50.11,54.889724,45.32802,42.07,46.8238,37.31789,21:05:08  6 Aug 2021,8.04,2021-08-06 21:05:08,Aug. 06
1933,Joseph R. Biden Jr.,Adults,08-05-21,50.11,54.889724,45.32802,42.07,46.8238,37.31789,21:00:10  5 Aug 2021,8.04,2021-08-05 21:00:10,Aug. 05
1936,Joseph R. Biden Jr.,Adults,08-04-21,50.56,55.605028,45.524311,41.78,46.673054,36.887414,14:15:09  4 Aug 2021,8.78,2021-08-04 14:15:09,Aug. 04
1939,Joseph R. Biden Jr.,Adults,08-03-21,50.98,55.724988,46.23142,41.48,46.780942,36.182429,12:30:11  3 Aug 2021,9.5,2021-08-03 12:30:11,Aug. 03
1948,Joseph R. Biden Jr.,Adults,08-02-21,50.91,56.108835,45.717086,42.4,46.29053,38.515249,09:30:20  2 Aug 2021,8.51,2021-08-02 09:30:20,Aug. 02
1951,Joseph R. Biden Jr.,Adults,07-30-21,50.91,56.108835,45.717086,42.4,46.29053,38.515249,09:30:10 30 Jul 2021,8.51,2021-07-30 09:30:10,Jul. 30
1954,Joseph R. Biden Jr.,Adults,07-29-21,50.91,56.095367,45.717542,42.4,46.287033,38.5185,21:40:09 29 Jul 2021,8.5,2021-07-29 21:40:09,Jul. 29
1957,Joseph R. Biden Jr.,Adults,07-28-21,51.54,56.969152,46.102978,42.26,46.251921,38.274777,11:46:09 28 Jul 2021,9.27,2021-07-28 11:46:09,Jul. 28
1960,Joseph R. Biden Jr.,Adults,07-27-21,52.36,57.362013,47.353693,41.99,45.936109,38.035551,10:19:08 27 Jul 2021,10.37,2021-07-27 10:19:08,Jul. 27
1969,Joseph R. Biden Jr.,Adults,07-26-21,52.33,57.28608,47.382428,41.87,45.777544,37.969934,09:01:17 26 Jul 2021,10.46,2021-07-26 09:01:17,Jul. 26
1972,Joseph R. Biden Jr.,Adults,07-23-21,52.33,57.28608,47.382428,41.87,45.777544,37.969934,13:35:09 23 Jul 2021,10.46,2021-07-23 13:35:09,Jul. 23
1975,Joseph R. Biden Jr.,Adults,07-22-21,52.04,56.635119,47.452506,41.84,45.755623,37.921719,22:31:09 22 Jul 2021,10.21,2021-07-22 22:31:09,Jul. 22
1978,Joseph R. Biden Jr.,Adults,07-21-21,51.67,56.511785,46.82211,41.65,45.54522,37.758862,15:36:08 21 Jul 2021,10.01,2021-07-21 15:36:08,Jul. 21
1981,Joseph R. Biden Jr.,Adults,07-20-21,52.37,57.275416,47.46158,41.48,45.419821,37.548343,10:44:08 20 Jul 2021,10.88,2021-07-20 10:44:08,Jul. 20
1984,Joseph R. Biden Jr.,Adults,07-19-21,52.61,57.735254,47.494448,41.47,45.463383,37.478969,09:43:07 19 Jul 2021,11.14,2021-07-19 09:43:07,Jul. 19
1990,Joseph R. Biden Jr.,Adults,07-18-21,50.65,54.907969,46.400379,41.5,45.659741,37.331425,13:54:15 18 Jul 2021,9.16,2021-07-18 13:54:15,Jul. 18
1993,Joseph R. Biden Jr.,Adults,07-16-21,50.65,54.907969,46.400379,41.5,45.659741,37.331425,09:30:10 16 Jul 2021,9.16,2021-07-16 09:30:10,Jul. 16
1996,Joseph R. Biden Jr.,Adults,07-15-21,50.51,54.676117,46.339995,41.47,45.604055,37.332158,09:37:09 15 Jul 2021,9.04,2021-07-15 09:37:09,Jul. 15
1999,Joseph R. Biden Jr.,Adults,07-14-21,50.48,54.758378,46.199168,41.49,45.710531,37.26456,11:42:08 14 Jul 2021,8.99,2021-07-14 11:42:08,Jul. 14
2002,Joseph R. Biden Jr.,Adults,07-13-21,51.03,54.915856,47.149459,41.26,45.384678,37.126989,09:33:08 13 Jul 2021,9.78,2021-07-13 09:33:08,Jul. 13
2011,Joseph R. Biden Jr.,Adults,07-12-21,51.03,54.915856,47.149459,41.26,45.384678,37.126989,09:47:16 12 Jul 2021,9.78,2021-07-12 09:47:16,Jul. 12
2014,Joseph R. Biden Jr.,Adults,07-09-21,51.03,54.915856,47.149459,41.26,45.384678,37.126989,10:35:08  9 Jul 2021,9.78,2021-07-09 10:35:08,Jul. 09
2017,Joseph R. Biden Jr.,Adults,07-08-21,51.03,54.915794,47.149521,41.26,45.384603,37.127064,22:05:08  8 Jul 2021,9.78,2021-07-08 22:05:08,Jul. 08
2020,Joseph R. Biden Jr.,Adults,07-07-21,51.21,55.169947,47.255558,41.03,45.130063,36.938777,12:10:08  7 Jul 2021,10.18,2021-07-07 12:10:08,Jul. 07
2026,Joseph R. Biden Jr.,Adults,07-06-21,50.73,54.75986,46.698902,41.67,45.297196,38.044294,11:50:13  6 Jul 2021,9.06,2021-07-06 11:50:13,Jul. 06
2032,Joseph R. Biden Jr.,Adults,07-04-21,50.81,55.009177,46.600876,41.7,45.486379,37.916459,12:51:13  4 Jul 2021,9.1,2021-07-04 12:51:13,Jul. 04
2035,Joseph R. Biden Jr.,Adults,07-02-21,50.81,55.009177,46.600876,41.7,45.486379,37.916459,11:21:07  2 Jul 2021,9.1,2021-07-02 11:21:07,Jul. 02
2038,Joseph R. Biden Jr.,Adults,07-01-21,50.76,55.156065,46.373683,41.65,45.531285,37.777861,21:44:07  1 Jul 2021,9.11,2021-07-01 21:44:07,Jul. 01
2041,Joseph R. Biden Jr.,Adults,06-30-21,50.8,55.418499,46.174985,41.72,45.586605,37.845606,13:13:08 30 Jun 2021,9.08,2021-06-30 13:13:08,Jun. 30
2044,Joseph R. Biden Jr.,Adults,06-29-21,51.43,55.780784,47.075314,41.57,45.546363,37.5931,21:15:10 29 Jun 2021,9.86,2021-06-29 21:15:10,Jun. 29
2050,Joseph R. Biden Jr.,Adults,06-28-21,51.22,55.407093,47.029323,41.63,45.578325,37.679533,09:50:12 28 Jun 2021,9.59,2021-06-28 09:50:12,Jun. 28
2053,Joseph R. Biden Jr.,Adults,06-26-21,51.22,55.407161,47.029254,41.63,45.578408,37.67945,17:10:08 26 Jun 2021,9.59,2021-06-26 17:10:08,Jun. 26
2056,Joseph R. Biden Jr.,Adults,06-25-21,51.2,55.47146,46.935853,41.42,45.391103,37.449278,10:14:08 25 Jun 2021,9.78,2021-06-25 10:14:08,Jun. 25
2059,Joseph R. Biden Jr.,Adults,06-24-21,51.12,55.443133,46.79936,41.4,45.41656,37.391599,18:53:06 24 Jun 2021,9.72,2021-06-24 18:53:06,Jun. 24
2062,Joseph R. Biden Jr.,Adults,06-23-21,50.94,55.335772,46.537003,41.63,45.746212,37.50919,18:54:07 23 Jun 2021,9.31,2021-06-23 18:54:07,Jun. 23
2065,Joseph R. Biden Jr.,Adults,06-22-21,50.9,55.409742,46.390352,42.06,46.276805,37.851172,20:36:07 22 Jun 2021,8.84,2021-06-22 20:36:07,Jun. 22
2074,Joseph R. Biden Jr.,Adults,06-21-21,50.69,55.200267,46.178664,41.65,46.111585,37.189836,08:17:14 21 Jun 2021,9.04,2021-06-21 08:17:14,Jun. 21
2077,Joseph R. Biden Jr.,Adults,06-18-21,50.69,55.200336,46.178594,41.65,46.11167,37.189751,13:05:07 18 Jun 2021,9.04,2021-06-18 13:05:07,Jun. 18
2080,Joseph R. Biden Jr.,Adults,06-17-21,50.69,55.200267,46.178664,41.65,46.111585,37.189836,20:59:07 17 Jun 2021,9.04,2021-06-17 20:59:07,Jun. 17
2083,Joseph R. Biden Jr.,Adults,06-16-21,50.81,55.322151,46.29304,40.71,45.438615,35.984092,12:23:08 16 Jun 2021,10.1,2021-06-16 12:23:08,Jun. 16
2086,Joseph R. Biden Jr.,Adults,06-15-21,52.07,56.194307,47.952658,39.64,44.237387,35.033061,10:24:10 15 Jun 2021,12.44,2021-06-15 10:24:10,Jun. 15
2095,Joseph R. Biden Jr.,Adults,06-14-21,52.07,56.194307,47.952658,39.64,44.237387,35.033061,13:02:15 14 Jun 2021,12.44,2021-06-14 13:02:15,Jun. 14
2098,Joseph R. Biden Jr.,Adults,06-11-21,52.07,56.194382,47.952584,39.64,44.237477,35.032972,23:06:07 11 Jun 2021,12.44,2021-06-11 23:06:07,Jun. 11
2101,Joseph R. Biden Jr.,Adults,06-10-21,51.88,55.839908,47.921154,39.6,44.205285,34.999152,09:34:08 10 Jun 2021,12.28,2021-06-10 09:34:08,Jun. 10
2104,Joseph R. Biden Jr.,Adults,06-09-21,52.08,56.199363,47.964078,39.35,44.124143,34.566036,14:47:08  9 Jun 2021,12.74,2021-06-09 14:47:08,Jun. 09
2107,Joseph R. Biden Jr.,Adults,06-08-21,52.24,56.377625,48.10863,39.19,44.234822,34.147151,12:30:11  8 Jun 2021,13.05,2021-06-08 12:30:11,Jun. 08
2116,Joseph R. Biden Jr.,Adults,06-07-21,52.26,56.400195,48.128294,39.34,44.448203,34.238714,09:29:15  7 Jun 2021,12.92,2021-06-07 09:29:15,Jun. 07
2119,Joseph R. Biden Jr.,Adults,06-04-21,52.26,56.400119,48.12837,39.34,44.448112,34.238805,21:00:12  4 Jun 2021,12.92,2021-06-04 21:00:12,Jun. 04
2122,Joseph R. Biden Jr.,Adults,06-03-21,52.26,56.400119,48.12837,39.34,44.448112,34.238805,20:56:07  3 Jun 2021,12.92,2021-06-03 20:56:07,Jun. 03
2125,Joseph R. Biden Jr.,Adults,06-02-21,52.34,56.590234,48.08722,38.88,44.000633,33.753729,09:39:08  2 Jun 2021,13.46,2021-06-02 09:39:08,Jun. 02
2137,Joseph R. Biden Jr.,Adults,06-01-21,52.22,56.823056,47.618987,40.27,44.3816,36.159793,09:28:18  1 Jun 2021,11.95,2021-06-01 09:28:18,Jun. 01
2140,Joseph R. Biden Jr.,Adults,05-28-21,52.22,56.823134,47.618909,40.27,44.381692,36.159701,13:54:08 28 May 2021,11.95,2021-05-28 13:54:08,May. 28
2143,Joseph R. Biden Jr.,Adults,05-27-21,52.54,57.082605,48.002243,40.12,44.295923,35.951388,19:41:07 27 May 2021,12.42,2021-05-27 19:41:07,May. 27
2146,Joseph R. Biden Jr.,Adults,05-26-21,52.9,57.59952,48.19837,39.4,43.267613,35.538575,21:22:07 26 May 2021,13.5,2021-05-26 21:22:07,May. 26
2149,Joseph R. Biden Jr.,Adults,05-25-21,53.44,58.17723,48.69416,39.36,43.51825,35.19902,10:55:28 25 May 2021,14.08,2021-05-25 10:55:28,May. 25
2158,Joseph R. Biden Jr.,Adults,05-24-21,53.45,58.17424,48.720638,39.2,43.301965,35.090203,09:09:12 24 May 2021,14.25,2021-05-24 09:09:12,May. 24
2161,Joseph R. Biden Jr.,Adults,05-21-21,53.45,58.17424,48.720638,39.2,43.301965,35.090203,21:02:06 21 May 2021,14.25,2021-05-21 21:02:06,May. 21
2164,Joseph R. Biden Jr.,Adults,05-20-21,53.23,58.162008,48.291281,39.21,43.613957,34.799075,10:15:10 20 May 2021,14.02,2021-05-20 10:15:10,May. 20
2167,Joseph R. Biden Jr.,Adults,05-19-21,53.39,58.508695,48.273418,39.09,43.60303,34.578956,16:44:07 19 May 2021,14.3,2021-05-19 16:44:07,May. 19
2170,Joseph R. Biden Jr.,Adults,05-18-21,53.39,58.414452,48.36384,38.72,43.210649,34.234118,13:58:08 18 May 2021,14.67,2021-05-18 13:58:08,May. 18
2179,Joseph R. Biden Jr.,Adults,05-17-21,53.86,59.00128,48.717952,38.23,42.873101,33.59642,08:53:11 17 May 2021,15.62,2021-05-17 08:53:11,May. 17
2182,Joseph R. Biden Jr.,Adults,05-14-21,53.86,59.001192,48.718041,38.23,42.873,33.596521,10:42:07 14 May 2021,15.62,2021-05-14 10:42:07,May. 14
2185,Joseph R. Biden Jr.,Adults,05-13-21,53.86,59.001192,48.718041,38.23,42.873,33.596521,09:54:07 13 May 2021,15.62,2021-05-13 09:54:07,May. 13
2188,Joseph R. Biden Jr.,Adults,05-12-21,53.86,59.272267,48.43997,37.96,42.814908,33.101895,13:13:06 12 May 2021,15.9,2021-05-12 13:13:06,May. 12
2191,Joseph R. Biden Jr.,Adults,05-11-21,54.1,59.549732,48.642604,37.85,42.845759,32.857516,10:07:07 11 May 2021,16.24,2021-05-11 10:07:07,May. 11
2200,Joseph R. Biden Jr.,Adults,05-10-21,53.08,57.637129,48.520045,38.67,43.777001,33.555917,09:11:11 10 May 2021,14.41,2021-05-10 09:11:11,May. 10
2203,Joseph R. Biden Jr.,Adults,05-07-21,53.08,57.63722,48.519953,38.67,43.777106,33.555812,21:27:07  7 May 2021,14.41,2021-05-07 21:27:07,May. 07
2206,Joseph R. Biden Jr.,Adults,05-06-21,53.09,57.654102,48.52028,38.65,43.767056,33.526439,13:18:07  6 May 2021,14.44,2021-05-06 13:18:07,May. 06
2209,Joseph R. Biden Jr.,Adults,05-05-21,53.02,57.635894,48.409279,38.78,43.981641,33.571901,20:59:07  5 May 2021,14.25,2021-05-05 20:59:07,May. 05
2212,Joseph R. Biden Jr.,Adults,05-04-21,53.46,57.83212,49.088867,38.35,43.496283,33.205887,09:39:07  4 May 2021,15.11,2021-05-04 09:39:07,May. 04
2218,Joseph R. Biden Jr.,Adults,05-03-21,54.22,58.587688,49.859903,39.85,44.286899,35.413048,09:09:09  3 May 2021,14.37,2021-05-03 09:09:09,May. 03
2221,Joseph R. Biden Jr.,Adults,05-01-21,54.22,58.587688,49.859903,39.85,44.286899,35.413048,20:20:07  1 May 2021,14.37,2021-05-01 20:20:07,May. 01
2224,Joseph R. Biden Jr.,Adults,04-30-21,54.13,58.581758,49.68344,40.22,44.664994,35.780024,16:50:10 30 Apr 2021,13.91,2021-04-30 16:50:10,Apr. 30
2227,Joseph R. Biden Jr.,Adults,04-29-21,53.98,58.375152,49.593715,40.35,44.717503,35.974921,17:57:07 29 Apr 2021,13.64,2021-04-29 17:57:07,Apr. 29
2230,Joseph R. Biden Jr.,Adults,04-28-21,54.0,58.464908,49.526907,40.59,44.88931,36.294067,18:58:07 28 Apr 2021,13.4,2021-04-28 18:58:07,Apr. 28
2233,Joseph R. Biden Jr.,Adults,04-27-21,54.41,58.974996,49.846465,40.88,45.172629,36.587854,13:30:08 27 Apr 2021,13.53,2021-04-27 13:30:08,Apr. 27
2236,Joseph R. Biden Jr.,Adults,04-26-21,54.33,59.191649,49.476275,40.07,44.322438,35.819283,17:19:06 26 Apr 2021,14.26,2021-04-26 17:19:06,Apr. 26
2242,Joseph R. Biden Jr.,Adults,04-25-21,53.17,58.356746,47.990639,38.86,43.030728,34.682564,13:00:11 25 Apr 2021,14.32,2021-04-25 13:00:11,Apr. 25
2245,Joseph R. Biden Jr.,Adults,04-23-21,53.17,58.356746,47.990639,38.86,43.030728,34.682564,18:01:07 23 Apr 2021,14.32,2021-04-23 18:01:07,Apr. 23
2248,Joseph R. Biden Jr.,Adults,04-22-21,52.97,58.188145,47.760206,38.88,43.101932,34.659215,21:22:10 22 Apr 2021,14.09,2021-04-22 21:22:10,Apr. 22
2251,Joseph R. Biden Jr.,Adults,04-21-21,53.12,58.454254,47.782653,38.65,43.004638,34.300373,10:15:08 21 Apr 2021,14.47,2021-04-21 10:15:08,Apr. 21
2254,Joseph R. Biden Jr.,Adults,04-20-21,53.03,58.185095,47.876797,39.36,43.729111,34.998121,13:35:08 20 Apr 2021,13.67,2021-04-20 13:35:08,Apr. 20
2263,Joseph R. Biden Jr.,Adults,04-19-21,52.81,57.894426,47.729679,39.47,43.740217,35.200007,09:33:10 19 Apr 2021,13.34,2021-04-19 09:33:10,Apr. 19
2266,Joseph R. Biden Jr.,Adults,04-16-21,52.81,57.894547,47.729558,39.47,43.740357,35.199867,15:54:06 16 Apr 2021,13.34,2021-04-16 15:54:06,Apr. 16
2269,Joseph R. Biden Jr.,Adults,04-15-21,52.79,57.867727,47.704571,39.66,43.926934,35.402155,16:28:06 15 Apr 2021,13.12,2021-04-15 16:28:06,Apr. 15
2272,Joseph R. Biden Jr.,Adults,04-14-21,52.1,57.040589,47.168062,39.62,44.35564,34.881789,14:09:06 14 Apr 2021,12.49,2021-04-14 14:09:06,Apr. 14
2275,Joseph R. Biden Jr.,Adults,04-13-21,53.2,57.976329,48.433548,38.02,42.650998,33.382761,09:39:06 13 Apr 2021,15.19,2021-04-13 09:39:06,Apr. 13
2284,Joseph R. Biden Jr.,Adults,04-12-21,53.13,58.06374,48.203295,38.17,42.966069,33.372224,10:07:09 12 Apr 2021,14.96,2021-04-12 10:07:09,Apr. 12
2287,Joseph R. Biden Jr.,Adults,04-09-21,53.13,58.06374,48.203295,38.17,42.966069,33.372224,15:21:06  9 Apr 2021,14.96,2021-04-09 15:21:06,Apr. 09
2290,Joseph R. Biden Jr.,Adults,04-08-21,53.13,58.063587,48.203449,38.17,42.9659,33.372393,20:50:07  8 Apr 2021,14.96,2021-04-08 20:50:07,Apr. 08
2293,Joseph R. Biden Jr.,Adults,04-07-21,52.9,57.969453,47.838499,38.49,43.372804,33.616937,11:08:06  7 Apr 2021,14.41,2021-04-07 11:08:06,Apr. 07
2296,Joseph R. Biden Jr.,Adults,04-06-21,53.75,58.748831,48.752536,38.02,42.86759,33.181776,10:01:07  6 Apr 2021,15.73,2021-04-06 10:01:07,Apr. 06
2299,Joseph R. Biden Jr.,Adults,04-05-21,53.75,58.748831,48.752536,38.02,42.86759,33.181776,16:44:05  5 Apr 2021,15.73,2021-04-05 16:44:05,Apr. 05
2302,Joseph R. Biden Jr.,Adults,04-04-21,54.1,59.610897,48.592378,39.07,43.536963,34.602646,21:48:04  4 Apr 2021,15.03,2021-04-04 21:48:04,Apr. 04
2305,Joseph R. Biden Jr.,Adults,04-03-21,54.09,59.597719,48.583846,39.08,43.5397,34.611603,18:53:04  3 Apr 2021,15.02,2021-04-03 18:53:04,Apr. 03
2308,Joseph R. Biden Jr.,Adults,04-02-21,54.06,59.631483,48.488215,38.9,43.364984,34.432398,15:20:07  2 Apr 2021,15.16,2021-04-02 15:20:07,Apr. 02
2311,Joseph R. Biden Jr.,Adults,04-01-21,53.93,59.520587,48.334918,38.37,42.790595,33.950013,23:17:05  1 Apr 2021,15.56,2021-04-01 23:17:05,Apr. 01
2314,Joseph R. Biden Jr.,Adults,03-31-21,54.35,59.929272,48.767423,38.47,42.879017,34.069235,19:48:07 31 Mar 2021,15.87,2021-03-31 19:48:07,Mar. 31
2317,Joseph R. Biden Jr.,Adults,03-30-21,54.25,59.195056,49.308881,38.49,43.158174,33.815964,15:48:05 30 Mar 2021,15.76,2021-03-30 15:48:05,Mar. 30
2326,Joseph R. Biden Jr.,Adults,03-29-21,54.56,59.976953,49.137712,38.71,43.792814,33.628902,11:09:08 29 Mar 2021,15.85,2021-03-29 11:09:08,Mar. 29
2329,Joseph R. Biden Jr.,Adults,03-26-21,54.56,59.976953,49.137712,38.71,43.792814,33.628902,16:53:05 26 Mar 2021,15.85,2021-03-26 16:53:05,Mar. 26
2332,Joseph R. Biden Jr.,Adults,03-25-21,54.56,60.120728,48.992304,38.78,43.957024,33.60924,21:13:04 25 Mar 2021,15.77,2021-03-25 21:13:04,Mar. 25
2335,Joseph R. Biden Jr.,Adults,03-24-21,54.87,60.443794,49.306022,38.4,43.523636,33.284994,13:16:06 24 Mar 2021,16.47,2021-03-24 13:16:06,Mar. 24
2338,Joseph R. Biden Jr.,Adults,03-23-21,55.38,60.761786,49.991739,38.12,43.12557,33.114701,09:57:05 23 Mar 2021,17.26,2021-03-23 09:57:05,Mar. 23
2347,Joseph R. Biden Jr.,Adults,03-22-21,54.43,59.721567,49.142229,38.96,43.921238,34.005804,09:38:07 22 Mar 2021,15.47,2021-03-22 09:38:07,Mar. 22
2350,Joseph R. Biden Jr.,Adults,03-19-21,54.43,59.721567,49.142229,38.96,43.921238,34.005804,12:55:06 19 Mar 2021,15.47,2021-03-19 12:55:06,Mar. 19
2353,Joseph R. Biden Jr.,Adults,03-18-21,54.43,59.721567,49.142229,38.96,43.921238,34.005804,20:54:05 18 Mar 2021,15.47,2021-03-18 20:54:05,Mar. 18
2356,Joseph R. Biden Jr.,Adults,03-17-21,53.81,59.131589,48.485206,39.43,44.318689,34.545105,17:05:05 17 Mar 2021,14.38,2021-03-17 17:05:05,Mar. 17
2359,Joseph R. Biden Jr.,Adults,03-16-21,54.24,59.538213,48.936106,39.65,44.465285,34.831783,13:47:05 16 Mar 2021,14.59,2021-03-16 13:47:05,Mar. 16
2362,Joseph R. Biden Jr.,Adults,03-15-21,54.24,59.538213,48.936106,39.65,44.465285,34.831783,10:35:07 15 Mar 2021,14.59,2021-03-15 10:35:07,Mar. 15
2368,Joseph R. Biden Jr.,Adults,03-14-21,52.99,57.935892,48.0478,39.91,44.772348,35.05312,11:57:08 14 Mar 2021,13.08,2021-03-14 11:57:08,Mar. 14
2371,Joseph R. Biden Jr.,Adults,03-12-21,52.99,57.935892,48.0478,39.91,44.772348,35.05312,22:00:08 12 Mar 2021,13.08,2021-03-12 22:00:08,Mar. 12
2374,Joseph R. Biden Jr.,Adults,03-11-21,52.98,57.974086,47.988438,40.01,44.935533,35.086773,21:52:04 11 Mar 2021,12.97,2021-03-11 21:52:04,Mar. 11
2377,Joseph R. Biden Jr.,Adults,03-10-21,52.84,57.899749,47.780901,38.25,43.351793,33.147248,13:46:05 10 Mar 2021,14.59,2021-03-10 13:46:05,Mar. 10
2380,Joseph R. Biden Jr.,Adults,03-09-21,53.53,58.648894,48.404119,37.27,42.435059,32.1144,21:39:04  9 Mar 2021,16.25,2021-03-09 21:39:04,Mar. 09
2389,Joseph R. Biden Jr.,Adults,03-08-21,53.45,58.482309,48.420629,37.28,42.348367,32.205632,09:23:06  8 Mar 2021,16.17,2021-03-08 09:23:06,Mar. 08
2392,Joseph R. Biden Jr.,Adults,03-05-21,53.45,58.482309,48.420629,37.28,42.348367,32.205632,19:47:04  5 Mar 2021,16.17,2021-03-05 19:47:04,Mar. 05
2395,Joseph R. Biden Jr.,Adults,03-04-21,52.65,57.489133,47.800918,36.81,41.947133,31.663656,20:59:03  4 Mar 2021,15.84,2021-03-04 20:59:03,Mar. 04
2398,Joseph R. Biden Jr.,Adults,03-03-21,52.23,56.996359,47.469784,36.99,42.14653,31.829197,15:32:05  3 Mar 2021,15.25,2021-03-03 15:32:05,Mar. 03
2401,Joseph R. Biden Jr.,Adults,03-02-21,53.31,58.197813,48.423419,35.14,40.044786,30.233635,10:54:06  2 Mar 2021,18.17,2021-03-02 10:54:06,Mar. 02
2410,Joseph R. Biden Jr.,Adults,03-01-21,54.54,59.55029,49.53304,36.61,41.231066,31.98296,09:34:08  1 Mar 2021,17.93,2021-03-01 09:34:08,Mar. 01
2413,Joseph R. Biden Jr.,Adults,02-26-21,54.54,59.55029,49.53304,36.61,41.231066,31.98296,09:55:05 26 Feb 2021,17.93,2021-02-26 09:55:05,Feb. 26
2416,Joseph R. Biden Jr.,Adults,02-25-21,54.54,59.55029,49.53304,36.61,41.231066,31.98296,19:38:05 25 Feb 2021,17.93,2021-02-25 19:38:05,Feb. 25
2419,Joseph R. Biden Jr.,Adults,02-24-21,54.38,59.3562,49.41025,36.52,41.169481,31.874814,13:00:08 24 Feb 2021,17.86,2021-02-24 13:00:08,Feb. 24
2422,Joseph R. Biden Jr.,Adults,02-23-21,54.37,59.296495,49.45176,36.59,41.27335,31.899813,10:22:06 23 Feb 2021,17.79,2021-02-23 10:22:06,Feb. 23
2431,Joseph R. Biden Jr.,Adults,02-22-21,53.84,58.749003,48.934092,36.93,41.716085,32.137391,09:40:08 22 Feb 2021,16.91,2021-02-22 09:40:08,Feb. 22
2434,Joseph R. Biden Jr.,Adults,02-19-21,53.84,58.749003,48.934092,36.93,41.716085,32.137391,13:49:04 19 Feb 2021,16.91,2021-02-19 13:49:04,Feb. 19
2437,Joseph R. Biden Jr.,Adults,02-18-21,53.84,58.749003,48.934092,36.93,41.716085,32.137391,21:23:04 18 Feb 2021,16.91,2021-02-18 21:23:04,Feb. 18
2440,Joseph R. Biden Jr.,Adults,02-17-21,53.74,58.598349,48.885205,36.98,41.789753,32.165507,12:21:04 17 Feb 2021,16.76,2021-02-17 12:21:04,Feb. 17
2443,Joseph R. Biden Jr.,Adults,02-16-21,53.9,58.584921,49.212853,36.34,40.978745,31.694172,09:35:05 16 Feb 2021,17.56,2021-02-16 09:35:05,Feb. 16
2452,Joseph R. Biden Jr.,Adults,02-15-21,53.9,58.587013,49.21781,36.33,40.974981,31.692333,10:19:06 15 Feb 2021,17.57,2021-02-15 10:19:06,Feb. 15
2455,Joseph R. Biden Jr.,Adults,02-12-21,53.9,58.58614,49.216691,36.33,40.97549,31.692561,13:57:05 12 Feb 2021,17.57,2021-02-12 13:57:05,Feb. 12
2458,Joseph R. Biden Jr.,Adults,02-11-21,53.9,58.58614,49.216691,36.33,40.97549,31.692561,14:38:04 11 Feb 2021,17.57,2021-02-11 14:38:04,Feb. 11
2461,Joseph R. Biden Jr.,Adults,02-10-21,53.82,58.549399,49.090499,36.37,41.056421,31.692546,20:14:04 10 Feb 2021,17.45,2021-02-10 20:14:04,Feb. 10
2464,Joseph R. Biden Jr.,Adults,02-09-21,54.09,58.635704,49.540965,36.23,40.772461,31.677723,18:22:05  9 Feb 2021,17.86,2021-02-09 18:22:05,Feb. 09
2473,Joseph R. Biden Jr.,Adults,02-08-21,52.49,56.920352,48.064936,35.3,39.724025,30.868609,09:37:05  8 Feb 2021,17.2,2021-02-08 09:37:05,Feb. 08
2476,Joseph R. Biden Jr.,Adults,02-05-21,52.49,56.920352,48.064936,35.3,39.724025,30.868609,16:08:04  5 Feb 2021,17.2,2021-02-05 16:08:04,Feb. 05
2479,Joseph R. Biden Jr.,Adults,02-04-21,53.13,57.639487,48.618048,34.52,39.028841,30.007402,19:52:04  4 Feb 2021,18.61,2021-02-04 19:52:04,Feb. 04
2482,Joseph R. Biden Jr.,Adults,02-03-21,51.02,55.628124,46.415588,33.05,37.653302,28.440766,15:31:05  3 Feb 2021,17.97,2021-02-03 15:31:05,Feb. 03
2485,Joseph R. Biden Jr.,Adults,02-02-21,51.57,56.188902,46.943442,31.24,35.862219,26.616759,15:41:05  2 Feb 2021,20.33,2021-02-02 15:41:05,Feb. 02
2494,Joseph R. Biden Jr.,Adults,02-01-21,53.11,58.022936,48.199606,31.16,36.074232,26.250902,09:14:05  1 Feb 2021,21.95,2021-02-01 09:14:05,Feb. 01
2497,Joseph R. Biden Jr.,Adults,01-29-21,53.11,58.022936,48.199606,31.16,36.074232,26.250902,16:55:08 29 Jan 2021,21.95,2021-01-29 16:55:08,Jan. 29
2500,Joseph R. Biden Jr.,Adults,01-28-21,53.11,58.022936,48.199606,31.16,36.074232,26.250902,19:57:04 28 Jan 2021,21.95,2021-01-28 19:57:04,Jan. 28
2503,Joseph R. Biden Jr.,Adults,01-27-21,53.24,58.364386,48.123041,31.55,36.672473,26.431128,17:10:07 27 Jan 2021,21.69,2021-01-27 17:10:07,Jan. 27
2515,Joseph R. Biden Jr.,Adults,01-26-21,55.0,61.45853,48.54147,32.0,38.45853,25.54147,10:18:18 26 Jan 2021,23.0,2021-01-26 10:18:18,Jan. 26
